Reference,ID,Tags,Quote,Occurrence,Question,Response
1:1,wxi8,,,0,What problem did King David have when he became old?,"Although they covered King David with blankets, he could not get warm."
1:4,ox0q,,,0,"Although Abishag was very beautiful and served the king by caring for him, what did David not do with her?",The king did not have sexual relations with Abishag.
1:5,ii0a,,,0,How did Adonijah the son of Haggith exalt himself?,"Adonijah wanted to be king, so he prepared for himself chariots and horses and 50 men to run ahead of him."
1:6,t9zi,,,0,Did King David discipline his son Adonijah and correct his actions?,"No, King David had never rebuked him for anything that he did."
1:7,v31o,,,0,Who were the two men who followed and helped Adonijah?,Joab and Abiathar helped Adonijah in his plot to become king.
1:9-10,o7b7,,,0,Who did Adonijah not invite to his sacrifice?,"Adonijah did not invite Nathan the prophet, Benaiah, the mighty men, or his brother Solomon."
1:11-12,k670,,,0,Who warned Bathsheba the mother of Solomon that Adonijah had become king and that her life was in danger?,Nathan the prophet warned Bathsheba that her life and the life of her son Solomon were both in danger.
1:13,fog7,,,0,What questions did Nathan tell Bathsheba to ask King David?,Nathan the prophet told Bathsheba to ask David whether he promised her that Solomon would be king and to ask why Adonijah is trying to be the next king.
1:17,oaez,,,0,What promise had King David sworn to Bathsheba?,David had sworn to Bathsheba that her son Solomon would be king after David died.
1:18-19,s4j1,,,0,What did Bathsheba tell King David that Adonijah had done?,"Bathsheba told him that Adonijah had become king without David knowing it, and that he had sacrificed animals in abundance."
1:21,wabk,,,0,What did Bathsheba fear would happen when David died?,She feared that she and her son Solomon would be regarded as if we had done something wrong.
1:24,e2t9,,,0,What question did Nathan the prophet ask of King David?,Nathan asked him if David had said that Adonijah would reign after him and sit on his throne as king.
1:24-25,z0s0,,,0,Why did Nathan the prophet come to visit King David?,Nathan the prophet came to inform King David that Adonijah was setting himself up as king without David’s knowledge.
1:29-30,tdqt,,,0,What oath did King David make to Bathsheba?,David made an oath that Solomon the son of Bathsheba would reign after him and sit on his throne in David’s place.
1:32-34,x5oc,,,0,"What did King David tell Zadok, Nathan, and Benaiah to do for his son Solomon?",King David told his three loyal subjects to take Solomon to Gihon on David’s own mule and to anoint him as king over Israel.
1:39-40,l17k,,,0,How did the people respond when Zadok anointed Solomon as king?,The people said “Long live King Solomon!” and rejoiced loudly.
1:51,te9w,,,0,What did Adonijah do when he heard the news that David had made Solomon the king of Israel?,"Adonijah was afraid of Solomon, and went into the temple of God and took hold of the horns of the altar."
1:53,pl8u,,,0,What did King Solomon tell Adonijah to do when they brought him before Solomon?,King Solomon told Adonijah to go to his house.
2:3,ay0g,,,0,What did King David tell his son Solomon?,David told his son to obey everything that God directed and instructed them to do.
2:4,bw7z,,,0,What was Yahweh’s promise to David?,Yahweh promised that David would never cease to have a descendant on Israel’s throne.
2:5-6,rd3b,,,0,"What did King David’s tell Solomon about Joab, the son of Zeruiah?",King David told Solomon not to let him die peacefully.
2:7,ns5w,,,0,What had the sons of Barzillai done for King David?,The sons of Barzillai had given David food and drink when he fled from Absalom.
2:8,y99o,,,0,What had Shimei done to King David?,Shimei had violently cursed King David.
2:9,kyln,,,0,What did Kind David tell Solomon to do to Shimei?,"David told Solomon not to let Shimei go free from punishment, but to bring him down to the grave with blood."
2:11,w7lq,,,0,How long did King David reign over Israel?,David reigned for 40 years.
2:15,lw8c,,,0,What did Adonijah say to Bathsheba when he came to her?,Adonijah said that all Israel expected him to be King but Yahweh gave it to his brother Solomon.
2:16,vpf0,,,0,What did Adonijah request from Bathsheba?,Adonijah requested that she ask Solomon for Abishag the Shunammite to be given to him as his wife.
2:20-21,ewoc,,,0,Why did Bathsheba go to Solomon?,Bathsheba went to Solomon to ask that Abishag would be given to Adonijah as his wife.
2:23,ph2z,,,0,What did King Solomon say in response to Bathsheba?,Solomon said that Adonijah had spoken this request at the cost of his life.
2:25,cjs9,,,0,Who did King Solomon send to execute Adonijah?,Solomon sent Benaiah son of Jehoiada to execute Adonijah.
2:27,sti8,,,0,What did King Solomon tell Abiathar the priest to do?,Solomon told Abiathar to go back to his fields and dismissed him from being priest.
2:28,bi6r,,,0,Where did Joab go to flee from Solomon?,Joab fled to the tent of Yahweh and took hold of the horns of the altar.
2:29,z2hg,,,0,What did King Solomon send Benaiah son of Jehoiada to do?,Solomon sent him to kill Joab.
2:30,mwk2,,,0,What did Joab say to Benaiah the son of Jehoiada?,Joab told him that he would not come out of the temple and would die at the altar.
2:31,ov8d,,,0,What did King Solomon tell Benaiah to do to Joab?,Solomon told Benaiah to do as Joab had said.
2:32-33,hcg4,,,0,Why did King Solomon want Joab to be killed?,"Solomon wanted Joab to be killed because Joab murdered two righteous men, Abner, commander of the army of Israel, and Amasa, the commander of the army of Judah, without King David knowing about it."
2:35,uluh,,,0,What did King Solomon do to reward Benaiah son of Jehoiada?,Solomon put him in charge of the army in place of Joab.
2:36,dg65,,,0,Where did King Solomon allow Shimei to live?,Solomon told Shimei that he could live in Jerusalem.
2:37,futr,,,0,What warning did King Solomon give to Shimei when he allowed him to live in Jerusalem?,"Solomon told Shimei that if he left Jerusalem to go any other place, he would die."
2:40,lobf,,,0,Why did Shimei saddle his donkey and leave Jerusalem to go to Gath?,Shimei went to Gath to bring back two of his servants who had run away from him.
2:44,skbb,,,0,What did King Solomon say that Shimei had done to Yahweh?,"Solomon told Shimei that he had not kept his oath to Yahweh, and that Yahweh would return his evil back on his own head."
2:46,zjsu,,,0,What did King Solomon do when he was told that Shimei had left Jerusalem?,Solomon told Benaiah the son of Jehoiada to put Shimei to death.
3:1,nzgm,,,0,How did King Solomon ally himself with Pharaoh king of Egypt?,Solomon allied himself to Pharaoh by marrying his daughter.
3:3,d4nz,,,0,What thing did King Solomon do that was not a statute of Yahweh?,Solomon sacrificed and burned incense at the high places.
3:4,y6bg,,,0,Where was the great shrine located?,The great shrine was located in Gibeon.
3:5,bjsg,,,0,How did Yahweh appear to King Solomon?,Yahweh appeared to Solomon in a dream at night.
3:9,s9ia,,,0,What did King Solomon ask of Yahweh?,Solomon asked Yahweh to give him an understanding heart to judge his people.
3:10,gjlb,,,0,Did King Solomon’s request please the Lord?,"Yes, Solomon’s request pleased the Lord."
3:12,rk7u,,,0,What did God give to King Solomon?,"God gave Solomon a wise and understanding heart, so that there was no one else like him either before or after him."
3:13,tn2z,,,0,Did God give King Solomon something for which he did not ask?,"Yes, God gave Solomon both riches and honor."
3:14,j0gy,,,0,What did God say he would do if Solomon walked in God’s statutes and commands as King David did?,God said he would lengthen Solomon’s days.
3:15,dy3c,,,0,What did King Solomon do after he woke up from sleeping?,Solomon entered Jerusalem and offered burnt offerings and peace offerings and made a feast for his servants.
3:16,me8d,,,0,Who came and stood before King Solomon?,Two women who were prostitutes came and stood before Solomon.
3:20,f6aa,,,0,What did the one woman say to King Solomon?,The one woman said that the other woman took her living son from her and laid the other woman’s dead son at her breast while she slept.
3:25,ob71,,,0,What command did King Solomon give to his servants?,Solomon said to bring a sword and divide the living child in two and give the parts to the two women.
3:26,xmj1,,,0,What did the first woman say to King Solomon?,The first woman said to give the living child to the second woman and not kill it.
3:27,qzuw,,,0,What did King Solomon say to do with the living child?,"Solomon said to give the living child to the first woman, his mother, and do not kill it."
3:28,wg52,,,0,What did all of Israel do when they heard of the judgment the king had given?,All of Israel feared the king because they saw the wisdom that God put within him to do justice.
4:1,rv5q,,,0,Was Solomon king over all Israel?,"Yes, Solomon was king over all of Israel."
4:2-5,snkc,,,0,Did King Solomon have officials and officers?,King Solomon had many men who were officials and officers.
4:7,m4cw,,,0,How long did each of Solomon’s deputies provide food for his household?,Each deputy had to make provision for one month of the year.
4:20,v13o,,,0,How numerous were Judah and Israel?,Judah and Israel were as numerous as the sand on the seashore.
4:21,hx04,,,0,How far did Solomon rule?,Solomon ruled over the kingdoms from the River to the land of the Philistines and to the border of Egypt.
4:22-23,hj84,,,0,What was Solomon’s provision for one day?,"Solomon’s provision for one day included flour, meal, oxen, sheep, deer, gazelles, roebucks, and fattened fowl."
4:25,xl21,,,0,How did Judah and Israel live all of the days of Solomon?,"Judah and Israel lived in safety, every man under his vine and under his fig tree, all the days of Solomon."
4:26,b7hf,,,0,How many stalls of horses did Solomon have for his chariots?,"Solomon had 40,000 stalls of horses for his chariots."
4:28,ptzq,,,0,What was brought for Solomon’s horses?,Barley and straw were brought for the chariot horses and the work horses.
4:29,wk1l,,,0,What did God give to Solomon?,God gave Solomon great wisdom and understanding.
4:31,x5hm,,,0,How far did Solomon’s fame reach?,Solomon’s fame reached to all of the surrounding nations.
4:32,jsxa,,,0,How many proverbs and songs did Solomon have?,"Solomon had 3,000 proverbs and 1,005 songs."
4:34,a8px,,,0,How far did people come to hear the wisdom of Solomon?,People came from all over the world to hear the wisdom of Solomon.
5:1,c12q,,,0,Who sent servants to Solomon?,Hiram king of Tyre sent his servants to Solomon.
5:3,b5go,,,0,Why was David not able to build a house for the name of Yahweh?,David was not able to build a house for the name of Yahweh because he led his soldiers to fight many wars against his enemies.
5:5,d5v5,,,0,What did Yahweh tell David?,"Yahweh told David, “Your son whom I will set on the throne will build a temple for my name.”"
5:6,ut70,,,0,What did Solomon ask Hiram to do?,Solomon asked Hiram to command his servants to cut cedars from Lebanon for him.
5:7,bs5t,,,0,What did Hiram do when he heard Solomon’s words?,"Hiram rejoiced greatly and said, “May Yahweh be blessed today.”"
5:8,x1oz,,,0,Did Hiram do what Solomon asked him to do?,"Yes, Hiram sent word saying, “I will do all you desire concerning the timber of cedar and cypress.”"
5:9,ldwz,,,0,What would Hiram’s servants do with the trees?,"Hiram’s servants brought the trees down from Lebanon to the sea, where they were made into rafts to sail the wood to the place that Solomon indicated."
5:9,j667,,,0,What did Hiram want Solomon to do for him?,Hiram desired that Solomon would supply food for his men.
5:11,fgyb,,,0,What food did Solomon give to Hiram?,"Solomon gave Hiram 20,000 measures of wheat and 20 measures of pure oil olive oil every year."
5:12,yfsf,,,0,Was there peace between Hiram and Solomon?,"Yes, there was peace between Hiram and Solomon, and the two of them made a covenant."
5:13,aj1r,,,0,How many forced laborers did Solomon have out of Israel?,"Solomon had 30,000 forced laborers out of Israel."
5:14,a699,,,0,Who did Solomon put over all of the forced laborers?,Solomon put Adoniram over all of the forced laborers.
5:16,l6kh,,,0,Did Solomon have men who supervised all of the workers?,"Yes, Solomon had 3,300 chief officers who were over the work and supervised the workers."
5:17,ford,,,0,What did the workers quarry for the foundation of the house of Yahweh?,The workers quarried large stones for the foundation of the house of Yahweh.
6:1,yimp,,,0,When did Solomon begin building the temple of Yahweh?,Solomon began building the temple of Yahweh in the 480th year after the people of Israel came out of Egypt.
6:2,w1a9,,,0,What were the dimensions of the temple that Solomon built for Yahweh?,"The temple that Solomon built was 60 cubits long, 20 cubits wide, and 30 cubits high."
6:4,qc07,,,0,Did Solomon make windows for the house?,"Yes, Solomon made framed windows for the house."
6:7,yzdd,,,0,Where were the stones for the house prepared?,The stones for the house were prepared at the quarry.
6:9,s5y2,,,0,What did Solomon use to cover the house?,Solomon covered the house with beams and boards of cedar.
6:10,cuvh,,,0,How were the side rooms joined to the house?,The side rooms were joined to the house with beams of cedar.
6:13,fade,,,0,Did Yahweh promise to live among the people of Israel?,"Yes, Yahweh promised to live among the people of Israel and to never abandon them."
6:15,gbtx,,,0,What did Solomon use to build the interior walls of the house?,Solomon used boards of cedar to build the interior walls of the house.
6:17,n1w9,,,0,What was the length of the main hall of the house?,The main hall of the house was 40 cubits long.
6:19,nlkw,,,0,Why did Solomon prepare the inner sanctuary inside the house?,Solomon prepared the inner sanctuary inside the house in order to place the Box of the Covenant of Yahweh there.
6:22,fukm,,,0,What did Solomon use to overlay the inside of the temple and the altar of the inner sanctuary?,Solomon overlaid the entire interior of the temple and the altar of the inner sanctuary with gold.
6:23,z7bs,,,0,What was the height of the cherubim that Solomon made for the most holy place?,Solomon made the two cherubim for the most holy place ten cubits high.
6:27,mlna,,,0,Where did Solomon place the cherubim he had made?,Solomon placed the cherubim in the midst of the inner house.
6:29,ld7y,,,0,What did Solomon carve on the walls of the house?,"Solomon carved figures of cherubim, palm trees, and open flowers on the walls of the house."
6:31,di5x,,,0,Did Solomon make doors for the entrance to the inner sanctuary?,"Yes, Solomon made doors of olive wood for the entrance to the inner sanctuary."
6:38,gjm2,,,0,How long did Solomon take to build the temple?,Solomon took seven years to build the temple.
7:1,gikk,,,0,How long did Solomon take to build his own palace?,Solomon took 13 years to build his own palace.
7:2,n94o,,,0,What forest did Solomon use to build his palace?,Solomon built his palace from the Forest of Lebanon.
7:6,wksb,,,0,How big was the Porch of Pillars at Solomon’s palace?,The colonnade at Solomon’s palace was 50 cubits long and 30 cubits wide.
7:7,icch,,,0,With what was floor of Solomon’s Porch of Justice covered?,The floor of Solomon’s Porch of Justice was covered with cedar wood.
7:8,dpql,,,0,"What did Solomon build for his wife, Pharaoh’s daughter?","Solomon built a house like his own for Pharaoh’s daughter, his wife."
7:10,rzfd,,,0,How big were the foundation stones of the buildings?,The foundation stones used for the buildings were eight and ten cubits in length.
7:12,gxt0,,,0,How many rows of cut stones did the great courtyard surrounding the palace have?,The great courtyard surrounding the palace had three rows of cut stones.
7:14,en0l,,,0,Who came to work with bronze for king Solomon?,Hiram came from Tyre to work with bronze for King Solomon.
7:15,kmf8,,,0,How many pillars of bronze did Hiram make?,Hiram made two pillars of bronze.
7:20,k0kg,,,0,What was included at the very top of the pillars?,There were two hundred pomegranates in rows at the top of the pillars.
7:23-25,z0sn,,,0,How many oxen did the sea stand on?,"The sea stood on twelve oxen, with three facing north, south, east and west."
7:27,b6xr,,,0,What was the height of the ten bronze stands that Hiram made?,The height of each of the ten stands was three cubits.
7:33,k8lh,,,0,What were the wheels underneath the panels made of?,The wheels underneath the panels were made of cast from bronze.
7:38,xxix,,,0,How much water could each of Hiram’s basins hold?,Hiram’s basins held 40 baths of water per basin.
7:40,trv8,,,0,Did Hiram finish the work in the temple of Yahweh?,"Yes, Hiram finished all of the work that he did for King Solomon in the temple of Yahweh."
7:42,m98y,,,0,How many pomegranates did Hiram make for the decorative latticework?,Hiram made 400 pomegranates for the decorative latticework.
7:48,o53a,,,0,What did Solomon use to make all of the furnishings in the temple of Yahweh?,Solomon used gold to make all of the furnishings in the temple of Yahweh.
7:51,gqi0,,,0,What did Solomon put in the storerooms of the house of Yahweh?,"Solomon put into the storerooms all of the silver, gold and furnishings that David his father had dedicated."
8:1,rzmn,,,0,Why did Solomon assemble the leaders of Israel before himself?,Solomon assembled the leaders of Israel to bring up the Box of the Covenant of Yahweh from the City of David.
8:2,wlhg,,,0,Who assembled before King Solomon at the feast?,All the men of Israel assembled before King Solomon at the feast.
8:3,rkln,,,0,Who carried the Box?,The priests carried the Box.
8:5,gnwj,,,0,What was sacrificed before the Box?,King Solomon sacrificed sheep and oxen that could not be counted before the Box.
8:6,z1hg,,,0,To where did the priests bring the Box of the Covenant of Yahweh?,"The priests brought the Box of the Covenant of Yahweh into the inner sanctuary, the Holy of Holies."
8:11,kayx,,,0,What filled the house of Yahweh?,The glory of Yahweh filled his house.
8:14,nfmd,,,0,What did the king do for the assembly of Israel?,The king blessed all of the assembly of Israel while they were standing.
8:19,bsgi,,,0,What had Yahweh told David?,Yahweh told David that his son would build the house for his name.
8:22,av3r,,,0,What did Solomon do before the altar of Yahweh?,Solomon stood before the altar of Yahweh and spread out his arms toward heaven.
8:26,u7sm,,,0,What did Solomon pray and ask of Yahweh?,Solomon prayed that the promise Yahweh made to David would be confirmed.
8:29,ljxt,,,0,What did Solomon pray for Yahweh to do?,Solomon prayed that Yahweh would have his eyes on the temple both night and day.
8:30,guy6,,,0,From where would Yahweh listen when Israel prayed to him?,"Yahweh would listen from the heavens, the place where he lived."
8:32,a4oy,,,0,What did Solomon ask Yahweh to do for the righteous person?,Solomon asked that the righteous would be declared innocent and rewarded according to his righteousness.
8:33,jiuf,,,0,When would Israel be defeated by an enemy?,Israel would be defeated by an enemy when they sinned against Yahweh.
8:35,fd4x,,,0,Why would the skies be shut and no rain fall?,The skies would be shut and rain not fall because the people sinned against Yahweh.
8:40,fkdm,,,0,Why did Solomon ask Yahweh to listen from heaven and forgive the sins of the people?,Solomon asked Yahweh to forgive the people so they would fear him all of the days they lived on the land Yahweh gave them.
8:41,wsh6,,,0,Why would a foreigner come from a distant country?,A foreigner would come from a distant country because of Yahweh’s name.
8:43,r55v,,,0,Why did Solomon ask Yahweh to do whatever the foreigner asks him to do?,Solomon asked Yahweh to do whatever the foreigner asks him to do so that all people groups would know his name and fear him.
8:46,nbwr,,,0,Why would an enemy carry Israel away captive to their land?,An enemy would carry Israel away captive because Yahweh was angry with Israel and handed them over to their enemy.
8:47,l9vs,,,0,What would the Israelites say in the land of their enemy?,"The Israelites would say, “We have acted wickedly and sinned. We have acted wickedly.”"
8:48,a0qu,,,0,What would the Israelites do in the land of their enemy?,The Israelites would return to Yahweh with all their heart and all their soul and pray toward him.
8:50,lwcd,,,0,What did Solomon ask Yahweh to do when his people prayed to him?,Solomon asked Yahweh to forgive his people and to have compassion on them.
8:51,ofmn,,,0,From where did Yahweh rescue his people?,"Yahweh rescued his people from out of Egypt, as out of a furnace."
8:52,epyo,,,0,What did Solomon ask Yahweh to do when his people cried to him?,Solomon asked Yahweh to open his eyes to their requests and to listen to them.
8:53,h4d9,,,0,Why did Yahweh separate his people from among all the peoples of the earth?,Yahweh separated his people from among all the peoples of the earth to belong to him and to receive his promises.
8:55,enft,,,0,What did Solomon do after he finished all his prayer and request to Yahweh?,"After he finished his prayer, Solomon stood and blessed all the assembly of Israel in a loud voice."
8:60,scai,,,0,What did Solomon want all peoples of the earth to know?,Solomon wanted all the peoples of the earth to know that Yahweh is God and there is no other God.
8:61,aqln,,,0,What did Solomon tell Yahweh’s people to do?,Solomon told them to keep their heart true to Yahweh and to walk in his statutes and commandments.
8:62,g4lk,,,0,Who offered sacrifices to Yahweh?,The king and all Israel with him offered sacrifices to Yahweh.
8:63,kgow,,,0,How many oxen and sheep did Solomon sacrifice?,"Solomon sacrificed 22,000 cattle and 120,000 sheep to Yahweh."
8:64,obmb,,,0,Why did the king consecrate the courtyard that was in front of the temple of Yahweh?,The king consecrated the courtyard because the bronze altar before Yahweh was too small for all of the offerings.
8:66,soww,,,0,When did the king send the people away back to their homes?,"On the eighth day, the king sent the people back to their homes."
9:2,cftz,,,0,"After Solomon finished building the house of Yahweh, what did Yahweh do?","When Solomon finished the house of Yahweh, he appeared to Solomon a second time."
9:3,oe8c,,,0,What did Yahweh say to Solomon?,"Yahweh said to Solomon, “I have heard your prayer and request you made before me.”"
9:4,uw1v,,,0,What did Yahweh want Solomon to obey?,Yahweh wanted Solomon to obey all the commandments and decrees that he had commanded him.
9:5,g0y8,,,0,"What did Yahweh promise to David, Solomon’s father?",Yahweh promised to establish the throne of David’s kingdom over Israel forever.
9:7,hloi,,,0,What did Yahweh tell Solomon he would do if Solomon did not keep his commandments?,Yahweh told Solomon that he would cut off Israel from the ground that he had given them.
9:8,c8n0,,,0,What would people ask when they passed by the temple of Yahweh?,"People would ask, “Why has Yahweh done this to this land and to this house?”"
9:9,cq35,,,0,Why would Yahweh bring this disaster on them?,Yahweh would bring disaster on them because they abandoned their God and worshiped other gods.
9:10,si4s,,,0,What happened at the end of 20 years?,"At the end of 20 years, Solomon finished building the temple of Yahweh and the king’s palace."
9:11,g83p,,,0,With what did Hiram king of Tyre furnish Solomon?,"Hiram king of Tyre furnished Solomon with cedar trees, cypress trees, and gold."
9:12,fj55,,,0,What did Hiram come from Tyre to see?,Hiram came from Tyre to see the cities that Solomon had given him.
9:13,xpus,,,0,What did Hiram call the cities which Solomon had given him?,"Hiram called the cites the land of Cabul, which means worthless."
9:14,gme2,,,0,How much gold did Hiram send to king Solomon?,Hiram had sent 120 kikkars of gold to the king.
9:15,nisg,,,0,"What did Solomon have built at Hazor, Megiddo, and Gezer?","Solomon had cities built at Hazor, Megiddo, and Gezer."
9:16,clr3,,,0,What did Pharaoh king of Egypt do at Gezer?,"Pharaoh king of Egypt took Gezer and burned it, and also killed the Canaanites in the city."
9:17,qnct,,,0,What did Solomon do at Gezer and Beth Horon?,Solomon rebuilt Gezer and Beth Horon.
9:21,vf2l,,,0,What did Solomon do with the people in the land who were not of Israel?,The people in the land who were not of Israel Solomon made into forced laborers.
9:22,san9,,,0,What did Solomon do with the people of Israel?,"Solomon made the people of Israel become soldiers, servants, officials, officers and commanders."
9:23,p5qh,,,0,How many chief officers did Solomon have?,Solomon had 550 chief officers who were over the supervisors.
9:25,e8ay,,,0,What did Solomon offer three times a year?,Solomon offered burnt offerings and peace offerings on the altar of Yahweh three times a year.
9:26,yhjx,,,0,What did Solomon do at Ezion Geber?,Solomon built a fleet of ships at Ezion Geber.
9:28,k7j4,,,0,Why did Solomon send servants to Ophir?,Solomon sent servants to Ophir to bring back gold.
10:1,uysy,,,0,Why did the queen of Sheba come to Solomon?,The queen of Sheba came to Solomon to test him with hard questions.
10:2,js82,,,0,What did the Queen of Sheba bring to Jerusalem?,"The Queen of Sheba brought spices, gold, and precious gemstones to Jerusalem with her."
10:3,hq6f,,,0,How many of the queen’s questions did Solomon answer?,Solomon answered all of the questions of the Queen of Sheba.
10:5,i8ay,,,0,How did the Queen of Sheba react when she saw all of Solomon’s wisdom?,"When the Queen of Sheba saw all of Solomon’s wisdom, it took her breath away."
