Reference,ID,Tags,Quote,Occurrence,Question,Response
10:7,wfvo,,,0,What did the queen of Sheba say to Solomon?,"The queen of Sheba said to Solomon, “You have exceeded the fame that I heard about you.”"
10:8,phv7,,,0,Why did the Queen of Sheba say that Solomon’s servants were blessed?,The Queen of Sheba said that Solomon’s servants were blessed because they heard his wisdom.
10:9,hyh1,,,0,How did Yahweh show his love to Israel?,Yahweh showed his love for Israel by making Solomon their king.
10:10,tgdz,,,0,What did the Queen of Sheba give to Solomon?,"The Queen of Sheba gave to Solomon 120 talents of gold, a large amount of spices, and precious stones."
10:11,cwvl,,,0,What did the fleet of Hiram bring from Ophir?,"The fleet of Hiram brought gold from Ophir, and almug wood and precious stones."
10:12,hnoz,,,0,What did the king make for the temple of Yahweh?,The king made almug wood pillars for the temple of Yahweh.
10:13,o3hs,,,0,What did King Solomon give to the queen of Sheba?,King Solomon gave to the Queen of Sheba everything she asked for.
10:14,inki,,,0,What was the weight of the gold that came to King Solomon in one year?,The weight of the gold that came to King Solomon in one year was 666 kikkars.
10:15,petr,,,0,Who brought gold and silver to Solomon?,The kings of Arabia and governors in the country brought gold and silver to Solomon.
10:16,f8jy,,,0,How many large shields of beaten gold did King Solomon make?,King Solomon made 200 shields of beaten gold.
10:17,vh3x,,,0,Where did King Solomon put 300 shields of beaten gold?,King Solomon put 300 shields of beaten gold into the Palace of the Forest of Lebanon.
10:18,niq4,,,0,What did the king make out of ivory and finest gold?,The king made a great throne of ivory and the finest gold.
10:19,holn,,,0,What was standing beside the armrests of the throne that the king made?,Two lions were standing beside the armrests of the throne that the king made.
10:20,d2k3,,,0,What stood on the side of the six steps at the throne?,Twelve lions were standing on the sides of the six steps at the throne.
10:21,o70u,,,0,Of what were the drinking cups in the Palace of the Forest of Lebanon made?,The drinking cups in the Palace of the Forest of Lebanon were made of pure gold.
10:22,z8e7,,,0,What did the king’s ships bring every three years?,"Every three years, the king’s ships brought gold, silver, ivory, apes, and peacocks."
10:24,l7cu,,,0,Why did all the earth seek out Solomon?,All the earth sought out Solomon to hear the wisdom God put in his heart.
10:25,vqfw,,,0,What tribute did Solomon’s visitors bring to him?,"Those who visited brought tribute such as gold, silver, clothing, armor, and spices, horses and mules."
10:26,tcix,,,0,Where did Solomon station his chariots and horsemen?,Solomon stationed his chariots and horsemen in the chariot cities and in Jerusalem.
10:27,x02t,,,0,What did the king do with cedar wood?,The king made cedar wood become as abundant as the sycamore fig trees in the lowlands.
10:28,jp4f,,,0,From where were Solomon’s horses brought?,Solomon’s horses were brought from Egypt and Kue.
10:29,bgbi,,,0,What was the purchase price of each chariot Solomon owned?,The chariots were purchased for 600 shekels of silver each.
11:1,cve2,,,0,Whom did King Solomon love?,King Solomon loved many foreign women.
11:2,igga,,,0,What did Yahweh command about marrying women from foreign nations?,Yahweh commanded Israel not to marry women from foreign nations.
11:3,t0sz,,,0,What did Solomon’s wives do to his heart?,"Solomon’s wives turned his heart away from God, worshiping foreign gods."
11:4,imm7,,,0,How was David’s heart toward Yahweh?,David’s heart was completely faithful to Yahweh his God.
11:5,frj4,,,0,What did Solomon follow?,"Solomon followed Ashtoreth, the goddess of the Sidonians, and Milcom, the disgusting god of the Ammonites."
11:6,tb8m,,,0,What did Solomon do in the sight of Yahweh?,Solomon did that which was evil in the sight of Yahweh.
11:7,pr7w,,,0,What did Solomon build for Chemosh?,"Solomon built a shrine for Chemosh, the idol of Moab."
11:8,wkf2,,,0,What did Solomon do at the shrines of his foreign wives?,Solomon burned incense and sacrificed to their gods at the shrines.
11:9,u85g,,,0,How many times did Yahweh appear to Solomon?,Yahweh appeared twice to Solomon.
11:10,lf0g,,,0,What did Yahweh command Solomon?,Yahweh commanded Solomon not to go after foreign gods.
11:11,r8e0,,,0,What did Yahweh tell Solomon he would do because of the foreign gods?,Yahweh told Solomon he would tear the kingdom from him and give it to his servant.
11:13,m1ss,,,0,How many tribes did Yahweh promise to give to Solomon’s son?,Yahweh promised to give one tribe to Solomon’s son.
11:14,n7jv,,,0,Whom did Yahweh raise up as an adversary to Solomon?,Yahweh raised up Hadad the Edomite as an adversary to Solomon.
11:15,efrz,,,0,Who went up to bury the dead who had been killed in Edom?,"Joab, the commander of the army, went up to bury the dead who were killed in Edom."
11:16,ks69,,,0,How long did Joab and Israel remain in Edom?,Joab and Israel remained in Edom six months.
11:17,kpi3,,,0,To where was Hadad taken?,Hadad was taken to Egypt.
11:19,pkvp,,,0,Whom did Pharaoh give as a wife to Hadad?,Pharaoh gave to Hadad the sister of Queen Tahpenes as his wife.
11:20,oscm,,,0,What was the name of Hadad’s son?,Hadad’s son was named Genubath.
11:21,qipw,,,0,What did Hadad ask of Pharaoh?,Hadad asked Pharaoh if he might depart and go to his own country.
11:23,woxj,,,0,What was the name of another adversary that God raised up against Solomon?,"God raised up another adversary to Solomon named Rezon, the son of Eliada."
11:24,s98e,,,0,To where did Rezon’s men travel?,Rezon’s men went to Damascus and lived there.
11:25,rxv1,,,0,How long was Rezon an enemy of Israel?,Rezon was an enemy of Israel all of the days of Solomon.
11:26,k9d0,,,0,Who else rebelled against the king?,Jeroboam the son of Nebat also rebelled against King Solomon.
11:27-31,xpiv,,,0,Why did Jeroboam raise his hand against the king?,Jeroboam the son of Nebat raised his hand against the king because the prophet Ahijah told him he would become king of ten tribes.
11:28,w8ex,,,0,What did Solomon give Jeroboam command over?,Solomon gave Jeroboam command over all the labor of the house of Joseph.
11:29,q2x3,,,0,Who found Jeroboam in the road as he went out of Jerusalem?,The prophet Ahijah found Jeroboam in the road as he went out of Jerusalem.
11:30,q489,,,0,What did Ahijah do to his new garment?,Ahijah took hold of the new cloak he was wearing and tore it into twelve pieces.
11:31,r57k,,,0,What did Yahweh say about Solomon’s kingdom?,"Yahweh said that he would tear the kingdom out of Solomon’s hand, giving ten tribes to Jeroboam."
11:32,nxwt,,,0,How many tribes would Solomon keep?,Solomon would keep one tribe for the sake of David.
11:34,nw7d,,,0,How long did Yahweh make Solomon to be ruler?,Yahweh made Solomon ruler all the days of his life.
11:36,r7bt,,,0,In which city did Yahweh choose to put his name?,Yahweh chose to put his name in the city of Jerusalem.
11:38,lb9e,,,0,What did Yahweh promise to do for Jeroboam if he walked in his ways?,Yahweh promised to be with him and give him an established house if Jeroboam walked in his ways.
11:40,osrj,,,0,What did Solomon try to do to Jeroboam?,Solomon tried to kill Jeroboam.
11:42,wb56,,,0,How long did Solomon reign in Jerusalem?,Solomon reigned in Jerusalem for 40 years.
11:43,b752,,,0,Who became king in Solomon’s place?,Rehoboam became king in Solomon’s place.
12:1,u2lc,,,0,Why did Rehoboam go to Shechem?,Rehoboam went to Shechem because all Israel was coming there to make him king.
12:3,gayr,,,0,Who came with the assembly of Israel to speak to Rehoboam?,Jeroboam the son of Nebat came with the assembly of Israel to speak to Rehoboam.
12:4,yij6,,,0,What did Israel ask of Rehoboam?,All Israel asked that Rehoboam would lighten the heavy yoke his father had put on them.
12:5,onna,,,0,For how many days did Rehoboam send the people away?,Rehoboam sent the people away for three days.
12:6,ux09,,,0,With whom did Rehoboam consult?,Rehoboam consulted with the older men who had advised Solomon his father.
12:7,gq0l,,,0,What did the older men say to Rehoboam?,The older men said that Rehoboam should speak kindly to the people of Israel.
12:8,eoie,,,0,What did Rehoboam do with the advice the older men gave him?,Rehoboam decided not to follow the advice of the older men.
12:10,x9ks,,,0,What did the younger men tell Rehoboam to say to the people?,"The younger men told Rehoboam to say, “I am going to rule you much more harshly than my father did.”"
12:11,i9rk,,,0,What did Rehoboam say he would use to punish the people?,Rehoboam said he would use scorpions to punish the people.
12:12,jjvv,,,0,What had the king instructed the people to do?,The king had instructed the people to come back on the third day.
12:13,ot6b,,,0,How did the king answer the people?,The king answered the people harshly.
12:14,bgqj,,,0,What did the king say he would do with the yoke on the people?,The king said he would add to the yoke on the people.
12:15,a8fh,,,0,Who brought about these events?,These events were brought about by Yahweh.
12:16,h2pz,,,0,What did all Israel say when they saw that the king did not listen to them?,All Israel said they would go home and not be ruled by Rehoboam. They said he can rule his own tribe but not the others.
12:17,qm0g,,,0,Over what people did Rehoboam become king?,Rehoboam became king over the people of Israel who lived in the cities of Judah.
12:18,wdr3,,,0,What did Israel do to Adoram?,All Israel stoned Adoram to death with stones.
12:20,dv3y,,,0,Who followed the family of David?,Only the tribe of Judah followed the family of David.
12:21,uduw,,,0,Why did Rehoboam assemble the house of Judah in Jerusalem?,Rehoboam assembled the house of Judah to fight against the house of Israel to return the rest of the kingdom to him.
12:22,q4dj,,,0,To whom did the word of God come?,The word of God came to Shemaiah the man of God.
12:24,n3fi,,,0,What did Yahweh say?,"Yahweh said, “You must not attack or fight against your fellow Israelites. Instead, go home.”"
12:25,dktx,,,0,Where did Jeroboam build Shechem?,Jeroboam built Shechem in the hill country of Ephraim.
12:26,bzrt,,,0,What did Jeroboam think in his heart?,"Jeroboam thought in his heart, “Now the kingdom will return to the house of David.”"
12:27,jny5,,,0,What did Jeroboam say about the people offering sacrifices in the temple of Yahweh?,"Jeroboam said, “If these people offer sacrifices in the temple of Yahweh, they will kill me and return to Rehoboam king of Judah.”"
12:28,v04v,,,0,What did King Jeroboam make?,King Jeroboam made two calves of gold.
12:29,l7jk,,,0,Where did Jeroboam set up the two calves of gold?,King Jeroboam set up one calf in Bethel and one in Dan.
12:31,totd,,,0,What people did Jeroboam make into priests?,Jeroboam made priests of the people who were not among the sons of Levi.
12:32,ch1y,,,0,What did Jeroboam do at Bethel?,Jeroboam made a feast at Bethel like the feast that was in Judah.
12:33,iaf5,,,0,What did Jeroboam do at the altar in Bethel?,Jeroboam went up to the altar to burn incense.
13:1,mjwk,,,0,Who came out of Judah by the word of Yahweh?,A man of God came out of Judah by the word of Yahweh.
13:2,v90g,,,0,What did the man of God cry out against the altar at Bethel?,"The man of God cried out against the altar, “On you they will burn men’s bones.”"
13:3,r8cc,,,0,What sign did the man of God give about the altar?,"The man of God gave a sign saying, “The altar will be split apart and the ashes on it will be poured out.”"
13:4,mgvf,,,0,What happened to Jeroboam’s hand when he reached out from the altar?,"When Jeroboam reached out from the altar, his hand was dried up so he could not draw it back to himself."
13:5,pnwu,,,0,What happened to the altar?,"The altar was split apart and the ashes poured out, just as the man of God described."
13:6,kcyl,,,0,What happened when the man of God prayed to Yahweh about Jeroboam’s hand?,"When the man of God prayed to Yahweh, the king’s hand was restored and became as it was before."
13:7,uut5,,,0,What did the king say to the man of God?,"The king said to the man of God, “Come home with me, and I will give you a reward.”"
13:8,fybt,,,0,What did the man of God say to the king?,"The man of God said to the king, “I will not go with you.”"
13:10,jwr4,,,0,What did the man of God do after speaking with the king?,"After speaking with the king, the man of God returned home by a different way than he came to Bethel."
13:11,nu0l,,,0,Where did an old prophet live?,An old prophet lived in Bethel.
13:12,gfxe,,,0,Who saw the way that the man of God had gone from Bethel?,The old prophet’s sons saw the way that the man of God walked who had come from Judah.
13:14,hu9i,,,0,Where did the old prophet find the man of God?,The old prophet found the man of God sitting under the oak tree.
13:15,nntp,,,0,What did the old prophet say to the man of God?,"The old prophet said to the man of God, “Come home with me and eat food.”"
13:16,fvyu,,,0,What was the man of God’s answer to the old prophet?,"The man of God answered, “I am not allowed to go with you into your house, or to eat or drink anything with you.”"
13:17-18,sqkb,,,0,What was the old prophet’s answer to the man of God?,The old prophet was lying to the man of God when he told him that an angel told the old prophet to bring him back to your house.
13:19,jcc2,,,0,Where did the man of God go after the old prophet lied to him?,The man of God went back and ate food and drank water in his house.
13:20,sy7m,,,0,What came to the old prophet as they sat at the table?,The word of Yahweh came to the old prophet as they sat at the table.
13:22,tl2t,,,0,What did the word of Yahweh say to the man of God?,"The word of Yahweh said, “Because you came back and ate food and drank water, your body will not be buried in the tomb of your fathers.”"
13:23,qq5f,,,0,What did the old prophet do after they ate?,"After they ate, the old prophet saddled the man of God’s donkey for him."
13:24,trr6,,,0,What happened after the man of God had gone?,"After the man of God had gone, a lion met him on the road and killed him."
13:25,kdtn,,,0,What did men do when they saw the body of the man of God lying on the road?,"When men saw the man of God’s body lying on the road, they came back and told it in the city of the old prophet."
13:26,nc1x,,,0,What was the old prophet’s answer to the men?,The old prophet answered that this was the man of God who had disobeyed the word of Yahweh.
13:28,cj4m,,,0,What did the old prophet do after hearing the men?,"The old prophet spoke to his sons to saddle his donkey, and he went and found the body left in the road."
13:30,w4ws,,,0,What did the old prophet do with the body of the man of God?,The old prophet took up the body of the man of God and buried him in his own grave.
13:31,wmh3,,,0,What did the old prophet say to his sons about his own burial?,"The old prophet said to his sons, “When I am dead, bury me in the tomb in which the man of God is buried.”"
13:33-34,o8ae,,,0,What thing became sin to the family of Jeroboam and caused it to be cut off from the face of the earth?,"Jeroboam did not turn away from evil, and even more, he consecrated as priests anyone who wanted to be a priest."
14:1,v7gk,,,0,What happened to Abijah the son of Jeroboam?,Abijah the son of Jeroboam fell sick.
14:2,gzs5,,,0,What did Jeroboam ask his wife to do?,Jeroboam asked his wife to disguise herself and go to the prophet Ahijah in Shiloh.
14:3,iwpc,,,0,Why did Jeroboam ask his wife to go to the prophet Ahijah?,Jeroboam asked his wife to go to the prophet Ahijah to find out what would happen to his sick son.
14:4,v80c,,,0,What was wrong with Ahijah’s eyes?,"Since Ahijah was old, he was blind and his eyes could not see."
14:5,fnrd,,,0,"Who told Ahijah, “The wife of Jeroboam is coming to see you.”?","Yahweh told Ahijah, “The wife of Jeroboam is coming to see you to seek advice concerning her son.”"
14:6,u8td,,,0,What did Ahijah say to the wife of Jeroboam?,"When Ahijah heard her come in at the door he said to her, “I know you are Jeroboam’s wife, so do not pretend that you are someone else.”"
14:8,ufrz,,,0,What did the God of Israel say about Jeroboam?,"The God of Israel said to Jeroboam, “You are not like my servant David, who kept my commandments.”"
14:9,due7,,,0,What did Jeroboam do to provoke Yahweh to anger?,Jeroboam cast metal images to provoke Yahweh to anger.
14:10,xyvz,,,0,What disaster would Yahweh bring on Jeroboam?,"Yahweh said that he would cut off from him every male of his household, whether they are family members or servants, whether they are young or old."
14:11,v13w,,,0,What would happen to anyone of Jeroboam’s family who died in the city?,Any of Jeroboam’s family who died in the city would be eaten by dogs.
14:12-13,mcm4,,,0,What would all Israel do for the child of Jeroboam?,All Israel would mourn for and bury the child of Jeroboam.
14:15,azx3,,,0,How far did Yahweh say that he would scatter Israel?,Yahweh said that he would scatter Israel beyond the Euphrates River.
14:15-16,dt3w,,,0,What did Yahweh say that Jeroboam led Israel to do?,"Yahweh said that Jeroboam led Israel to worship statues of the goddess Asherah, as he was doing."
14:17,fpxy,,,0,What happened when Jeroboam’s wife came to the threshold of the house?,"When Jeroboam’s wife came to the threshold of the house, the child died."
14:18,olbs,,,0,What did all Israel do after the child died?,All Israel buried him and mourned for him.
14:19,tf5j,,,0,Where were the other matters concerning Jeroboam written?,The other matters concerning Jeroboam were written in the book of the matters of the days of the kings of Israel.
14:20,xlsv,,,0,How many years did Jeroboam reign before he slept with his fathers?,"Jeroboam reigned for 22 years, and he slept with his fathers."
14:21,xs2t,,,0,Who was reigning in Judah?,Rehoboam the son of Solomon was reigning in Judah.
14:22,bebn,,,0,How did Judah provoke Yahweh to jealousy?,Judah provoked Yahweh to jealousy with the sins they committed.
14:23,zoxl,,,0,What did Judah build on every high hill and under every green tree?,Judah built shrines and Asherah poles on every high hill and under every green tree.
14:24,r0pr,,,0,What despicable things did the nations do?,The Israelite people did the same disgraceful things with male prostitutes that the people had done whom Yahweh had forced to leave so that the Israelites could possess the land.
14:25,ge59,,,0,In what year did Shishak come up against Jerusalem?,"In the fifth year of King Rehoboam, Shishak came up against Jerusalem."
14:26,ag6r,,,0,What shields did Shishak take away from Jerusalem?,Shishak took all the shields of gold that Solomon had made.
14:27,j41b,,,0,What did King Rehoboam do with the shields of bronze that he made?,King Rehoboam put them into the hands of the palace guards.
14:28,v0sp,,,0,When would the guards carry the shields of bronze?,"Whenever the king entered the house of Yahweh, the guards would carry the shields."
14:29,fqqp,,,0,Where were the other matters of King Rehoboam written?,The other matters of King Rehoboam were written in book of the matters of the days of the kings of Judah.
14:31,gxwc,,,0,Who became king in Rehoboam’s place?,"Abijah, Rehoboam’s son, became king in his place."
15:1,c2vq,,,0,When did Abijah begin to reign over Judah?,Abijah began to reign over Judah in the eighteenth year of King Jeroboam.
15:2,bi5a,,,0,How long did Abijah rule in Jerusalem?,Abijah ruled in Jerusalem for three years.
15:3,rm1c,,,0,Was Abijah’s heart devoted to Yahweh his God?,Abijah’s heart was not devoted to Yahweh his God.
15:4,hy69,,,0,Why did Yahweh raise up a son for Abijah in Jerusalem?,Yahweh raised up a son for Abijah for the sake of David.
15:5,z05b,,,0,In what matter did David turn away from Yahweh?,David only turned away from Yahweh in the matter of Uriah the Hittite.
15:6,olrf,,,0,What happened all the days of Abijah’s life?,There was war between Rehoboam and Jeroboam all the days of Abijah’s life.
15:8,vdxq,,,0,"When Abijah slept with his fathers, who became king in his place?","When Abijah slept with his fathers, Asa became king in his place."
15:9,lkxc,,,0,When did Asa begin to reign over Judah?,Asa began to reign over Judah in the twentieth year of Jeroboam king of Israel.
15:10,evro,,,0,How many years did Asa reign in Jerusalem?,Asa reigned 41 years in Jerusalem.
15:11,gipr,,,0,What did Asa do in the eyes of Yahweh?,"Asa did what was right in the eyes of Yahweh, as David had done."
15:12,crin,,,0,What did Asa do in the land?,Asa removed the male prostitutes and the idols his ancestors had made in the land.
15:13,pd57,,,0,Whom did Asa remove from being queen?,Asa removed his own grandmother Maacah from being queen.
15:14,osm9,,,0,What was the condition of Asa’s heart toward Yahweh?,Asa’s heart was completely dedicated to Yahweh all his days.
15:15,fjrv,,,0,What did Asa bring into the house of Yahweh?,Asa brought all the items that his father had dedicated to God and all the gold and silver things that he had dedicated to God into the house of Yahweh.
15:16,j4o4,,,0,With whom was Asa at war?,Asa was at war with Baasha king of Israel all their days.
15:17,r4xi,,,0,Why did Baasha build up Ramah?,Baasha built up Ramah so that no one would enter into or leave the area that King Asa ruled.
15:18,dapd,,,0,What did Asa do with all the silver and gold from the storerooms of the house of Yahweh?,"Asa sent the silver and gold to Ben Hadad, the grandson of the king of Aram, who lived in Damascus."
15:19,x8g7,,,0,What did Asa say to Benhadad?,"Asa said to Benhadad, “Let there be a treaty between me and you, as there was between my father and your father.”"
15:20,r3ut,,,0,What did Benhadad do after he listened to Asa?,"After he listened to Asa, Benhadad sent his armies to attack the cities of Israel."
15:21,x498,,,0,What did Baasha do when he heard about this?,"When Baasha heard about the attacks, he stopped building up Ramah."
15:22,t6v6,,,0,What did Asa do with the materials that had been used to build up Ramah?,Asa took the materials that had been used to build up Ramah and used them to build up Geba and Mizpah.
15:23,fjcn,,,0,Where were all of Asa’s matters written?,All of Asa’s matters were written in the book of the matters of the days of the kings of Judah.
15:24,rfc9,,,0,"After Asa slept with his fathers, who became king in his place?","After Asa slept with his fathers, his son Jehoshaphat became king in his place."
15:25,bwb1,,,0,Who began to reign over Israel in the second year of Asa?,Nadab the son of Jeroboam began to reign over Israel in the second year of Asa.
15:26,kc8n,,,0,How did Nadab walk in the sight of Yahweh?,Nadab did evil in the sight of Yahweh and walked in the ways of his father and in his sin.
15:27,n9fh,,,0,What did Baasha son of Ahijah do at Gibbethon?,Baasha the son of Ahijah killed Nadab at Gibbethon.
15:29,tb5b,,,0,What did Baasha do as soon as he became king?,"As soon as Baasha became king, he killed all of the family of Jeroboam. He did not leave one of Jeroboam’s descendants breathing."
15:32,u8a9,,,0,How long was there war between Asa and Baasha?,There was war between Asa and Baasha all their days.
15:33,pv2g,,,0,How long did Baasha reign in Tirza?,Baasha reigned in Tirza for 24 years.
15:34,njyr,,,0,How did Baasha live?,Baasha did evil in the sight of Yahweh and lived in the way of Jeroboam. encouraging his people to sin in the same way that he sinned.
16:2,pedj,,,0,Out of what did Yahweh raise Baasha?,Yahweh raised him out of the dust.
16:4,uv9x,,,0,What would eat anyone belonging to Baasha who died in the city?,The dogs would eat anyone belonging to Baasha who died in the city.
16:7,wdm8,,,0,Why did the word of Yahweh come against Baasha and his family?,The word of Yahweh came against Baasha and his family both because of all the evil he did in the sight of Yahweh and also because he had killed all of Jeroboam’s family.
16:8-10,sc24,,,0,What was Elah doing when Zimri killed him?,Elah was drinking himself drunk in the house of Arza when Zimri killed him.
16:11,g25j,,,0,When did Zimri kill all the family of Baasha?,"When Zimri began to reign, as soon as he had sat on his throne, he killed all the family of Baasha."
16:15,i31i,,,0,To whom did Gibbethon belong?,Gibbethon belonged to the Philistines.
16:18,moee,,,0,Where did Zimri kill himself?,"Zimri killed himself in the citadel attached to the king’s palace, burning it down over himself and dying in the fire."
16:21,blnq,,,0,About what two leaders were the people of Israel divided into two parts?,"The people of Israel divided into two parts about who should be their king, Tibni or Omri."
16:24,spzd,,,0,Why did Omri call the name of the city Samaria?,"Omri called the name of the city Samaria, after the name of Shemer, the owner of the hill."
16:28,kgr7,,,0,Who became king in Omri’s place?,Ahab his son became king in his place.
16:32,c48t,,,0,Who had built the house of Baal in Samaria?,Ahab had built the house of Baal in Samaria.
16:34,e51j,,,0,What caused the loss of Hiel’s son Abiram?,"Hiel began rebuilding Jericho, causing the loss of his oldest son, Abiram."
17:1,ep0u,,,0,What ominous message did Elijah give to Ahab?,"Elijah told Ahab that as Yahweh lives, there would be no dew or rain unless he said so."
17:4,qmg1,,,0,Who did Yahweh command to feed Elijah while Elijah was at the brook Cherith?,Yahweh commanded the ravens to feed Elijah at the brook Cherith.
17:7,q15s,,,0,What happened when there was no rain in the land?,The brook dried up when there was no rain in the land.
17:8-10,z0dc,,,0,Where did Elijah go after the brook dried up?,Yahweh sent Elijah to a widow in Zarephath.
