Reference,ID,Tags,Quote,Occurrence,Question,Response
17:12,okt1,,,0,Why was the widow gathering two sticks?,"The widow was gathering two sticks so she could go in and cook for herself and her son, that they could eat, and die from hunger."
17:14,yado,,,0,For how long would the widow’s jar of meal and jug of oil be full?,They would be full until the day that Yahweh sent rain on the earth.
17:17,zuvk,,,0,How sick was the woman’s son?,The son’s sickness was so severe that there was no more breath left in him.
17:21,c998,,,0,What did Elijah do to save the child?,"Elijah stretched himself on the child three times; he cried out to Yahweh and said, “Yahweh my God, please let this child become alive again.”"
17:22-24,samh,,,0,How did the woman know that Elijah was a man of God?,"The woman knew that Elijah was a man of God when her son revived, and Elijah took the child and gave him to his mother."
18:1-2,cne2,,,0,What message did Yahweh ask Elijah to give to Ahab during the severe famine?,Yahweh asked Elijah to tell Ahab he would send rain on the land.
18:3-4,aotq,,,0,How did Obadiah honor Yahweh when Jezebel was killing the prophets of Yahweh?,Obadiah honored Yahweh by hiding 100 prophets by fifties in a cave and feeding them with bread and water.
18:5,hjc5,,,0,Why did Ahab and Obadiah go through the land to all the water springs and brooks?,Ahab and Obadiah were searching for water and grass so they could keep a horse or a mule alive.
18:7-8,ngsm,,,0,What dangerous message did Elijah ask Obadiah to tell Ahab?,Elijah asked Obadiah to tell Ahab that Elijah is here.
18:9-11,n19x,,,0,Why was Obadiah reluctant to tell Ahab that “Elijah is here.”?,"Obadiah was reluctant to tell Ahab, “Elijah is here,” because all the nearby nations had taken an oath swearing that Elijah was not there."
18:12,awwa,,,0,What did Obadiah think would happen as soon as he left Elijah?,Obadiah thought the Spirit of Yahweh would carry Elijah some place Obadiah would not know.
18:14-15,iyd1,,,0,What did Elijah tell Obadiah to calm his fears?,"Elijah told Obadiah that as Yahweh lives, he would surely show himself to Ahab that day."
18:16-17,ek0e,,,0,What did Ahab call Elijah when he met him?,Ahab called Elijah “one troubling Israel” when he met him.
18:18,r9wq,,,0,How did Elijah respond to Ahab calling him a “troublemaker”?,Elijah told the king that Ahab and his father’s family were the troublemakers because they abandoned the commandments of Yahweh to follow the Baals.
18:19,hh9r,,,0,Who did Elijah say to gather on Mount Carmel?,"Elijah said to gather all the people of Israel, along with the 450 prophets of Baal and the four hundred prophets of Asherah who eat at Jezebel’s table."
18:21,ghh8,,,0,Who did Elijah tell the people they should follow?,Elijah told the people to follow Yahweh if he was God or follow Baal if he was truly God.
18:22-24,tv47,,,0,What proposal did Elijah bring before the people?,Elijah proposed that he and the prophets of Baal each call upon their god to consume the sacrifice of a bull by fire to prove which one was God.
18:26,ule8,,,0,How long did the prophets of Baal call on Baal?,The prophets of Baal called on Baal from morning until noon.
18:28,bj5y,,,0,"After Elijah mocked the prophets of Baal at noon, what did the prophets of Baal do?",The prophets of Baal cried more loudly and cut themselves with swords and spears.
18:29,ai1k,,,0,How long did the prophets of Baal continue their raving?,The prophets of Baal were raving until the time of the evening sacrifice.
18:30-32,zm6i,,,0,What did Elijah do to the ruined altar of Yahweh?,Elijah repaired the altar of Yahweh with twelve stones.
18:32,ljvm,,,0,What did Elijah make around the altar of Yahweh?,Elijah dug a trench around the altar of Yahweh.
18:33-34,cgfn,,,0,What did Elijah have the people do to the wood and the bull for the burnt offering?,Three times Elijah had the people fill four jars with water and pour them on the burnt offering and the wood.
18:38-39,zzlb,,,0,How did the people of Israel respond when the fire of Yahweh fell and consumed the sacrifice and everything around it?,"The people lay face down on the ground and said, “Yahweh, he is God! Yahweh, he is God!”"
18:40,olzo,,,0,What did Elijah do with the prophets of Baal?,Elijah brought the prophets of Baal down to the brook of Kishon and killed them.
18:43-44,u3c2,,,0,What did the servant of Elijah see after he looked toward the sea seven times?,"On the seventh time, the servant saw a cloud as small as a man’s hand."
18:44,edkz,,,0,What did Elijah tell his servant to say to Ahab?,Elijah told his servant to tell Ahab to make ready his chariot and go down so the rain would not stop him.
18:46,casj,,,0,What did Elijah do as Ahab rode and went to Jezreel?,Elijah tucked his robe in his belt and ran before Ahab to the entrance of Jezreel.
19:1-2,q524,,,0,What threat did Jezebel make to Elijah?,"Jezebel told Elijah that by the next day she would have killed him, just like he killed all those prophets of Baal."
19:3,u55r,,,0,How did Elijah respond to the threat from Jezebel?,Elijah fled for his life to Beersheba.
19:4,o2c7,,,0,Why did Elijah request that he might die?,Elijah requested that he might die because he felt he was no better than his dead ancestors.
19:5,vrz3,,,0,What happened as Elijah was sleeping under a juniper tree?,"An angel touched Elijah and said to him, “Get up and eat.”"
19:6,tzuq,,,0,What did Elijah see and do after the angel touched him?,"Elijah saw bread that had been baked on coals and a jug of water. Elijah ate and drank, and then he lay down again."
19:8,a7je,,,0,"How long did it take Elijah to get to Horeb, the mountain of God?",Elijah traveled 40 days and 40 nights to Horeb.
19:9-10,y41g,,,0,How did Elijah respond when Yahweh asked him what he was doing in a cave?,"Elijah told Yahweh that he had been very zealous for him, but the people of Israel had forsaken his covenant, destroyed his altars, and killed his prophets, and he was the only one left, and they sought to kill him too."
19:15-16,ul6j,,,0,What did Yahweh tell Elijah to do?,"Yahweh told Elijah to return to the wilderness near Damascus to anoint Hazael to be king over Aram, Jehu to be king over Israel, and Elisha to be a prophet in his place."
19:18,y8c3,,,0,How did Yahweh respond to Elijah’s claim that he was the only prophet left in the land?,"Yahweh told Elijah there were 7,000 people in Israel who never worshiped Baal."
19:19-20,tnac,,,0,What excuse did Elisha give to Elijah after he draped his cloak on him?,Elisha asked Elijah to let him kiss his mother and father before he followed him.
20:1-3,unjd,,,0,What was the message which Ahab received from Ben Hadad when the city of Samaria was under siege?,Ben Hadad told Ahab that his silver and gold as well as his wives and children were now Ben Hadad’s possessions.
20:4-6,gi9m,,,0,"How did Ben Hadad respond to Ahab’s willingness to give him his silver, gold, wives, and children?","Ben Hadad informed Ahab that he was sending his servants the next day, and they would seize with their hands anything valuable of Ahab’s and bring it to him."
20:7-8,nxmc,,,0,What was the advice which the king of Israel received from all the elders of the land and the people?,The elders of the land and the people told the king not to listen or consent to the demands of Ben Hadad.
20:9,yukx,,,0,What was the message Ahab sent back to Ben Hadad?,"Ahab told Ben Hadad that he was agreeable to his first demand, but he could not accept his second demand."
20:10,h0wh,,,0,What was the response of Ben Hadad to the message of Ahab?,Ben Hadad took an oath that he would reduce Samaria less than a handful of ashes.
20:11-12,cq4b,,,0,What did Ben Hadad say when the king of Israel told him that he should not boast as if the battle were over?,Ben Hadad told his soldiers to prepare to attack the city.
20:13-15,i6ds,,,0,Who did Yahweh say would win the battle for Israel against the great army of the Arameans?,Yahweh told Ahab that the 232 young soldiers commanded by the district governors would win the battle for Israel.
20:16-17,klnd,,,0,"When the young soldiers advanced first, what were Ben Hadad and the 32 lesser kings who were supporting him doing?",Ben Hadad and his 32 lesser kings were drinking themselves drunk.
20:20-21,wbxg,,,0,What happened to Ben Hadad and the Arameans?,"Ben Hadad escaped on a horse with some horsemen, and many of the Arameans were killed in a great slaughter."
20:22,n3ih,,,0,What message did the prophet bring to the king of Israel?,"The prophet told the king of Israel that the king of Aram would return against them again, so Israel should strengthen itself and think carefully and prepare for what they would do."
20:23,o070,,,0,What did the servants of the king of Aram give as the reason for Israel being stronger in battle than the Arameans?,"The servants of the king of Aram told him Israel was stronger than the Arameans, since their god is a god of the hills."
20:26,hw7x,,,0,What did Ben Hadad do after the beginning of the new year?,Ben Hadad mustered the Arameans and went up to Aphek to fight against Israel.
20:28,en76,,,0,What did a man of God say to the king of Israel concerning the Arameans?,"The man of God said that because the Arameans said God was a god of the hills and not a god of the valleys, God was going to place the Aramean army into the hands of the king of Israel in the valley."
20:29-30,a42e,,,0,What was the outcome of the battle between the armies?,"Israel killed 100,000 Aramean footmen in one day. The rest fled to Aphek, into the city where a wall fell on 27,000 men who were left, and Ben Hadad fled into the city, into an inner room."
20:31-32,vhn6,,,0,What did Ben Hadad’s servants do for Ben Hadad?,Ben Hadad’s servants put sackcloth on their waists and ropes around their heads and went to the king of Israel and begged the king of Israel to let Ben Hadad live.
20:33-34,dwdp,,,0,What proposal did Ben Hadad make to Ahab when he was summoned to meet with him in his chariot?,Ben Hadad told Ahab that he would restore to him the cities which had been taken from Israel if Ahab would let him go.
20:35-36,m5t2,,,0,Why was one of the prophets killed by a lion?,One of the prophets was killed by a lion because he did not obey the voice of Yahweh by hitting his fellow prophet.
20:37-38,zs6x,,,0,How did the prophet disguise himself from the king after he had been hit and wounded?,The prophet disguised himself from the king with a bandage over his eyes.
20:39-40,a6pq,,,0,Why did the prophet tell a story to the king of Israel?,"The prophet told the story to the king of Israel to deceive him, so the king would make a ruling which would result in the forfeit of the king’s own life."
20:41-42,ohgh,,,0,What bold statement did the prophet make to the king of Israel?,The prophet told the king that he would lose his own life since he had allowed the man to live whom Yahweh had sentenced to death.
21:1-2,vncn,,,0,What did Ahab the king of Samaria want from Naboth the Jezreelite?,"Ahab, king of Samaria, wanted the vineyard from Naboth, which was near his palace."
21:2,ygxa,,,0,What did Ahab offer Naboth for his vineyard?,Ahab offered to give Naboth a better vineyard or to pay him in silver.
21:3,wd22,,,0,Why did Naboth refuse to give his vineyard to Ahab?,Naboth refused to give his vineyard to Ahab because it was the inheritance of his ancestors.
21:4,a90h,,,0,What did Ahab do when Naboth refused to give up his vineyard?,"Ahab became resentful and angry, went to bed, and refused to eat any food."
21:7,l1e5,,,0,"Who told Ahab to get up from bed, eat, and be happy?","Ahab’s wife, Jezebel, told him to get out of bed, eat, and be happy. She said she would get the vineyard for him."
21:8-11,ajop,,,0,What did Jezebel do to make sure Ahab would get Naboth’s vineyard?,Jezebel had two dishonest men falsely accuse Naboth of blasphemy against God and the king at a public fast.
21:10,hfdw,,,0,What would be the penalty for Naboth’s blasphemy?,Naboth would be taken out and stoned to death.
21:17-18,e9zs,,,0,Who did Yahweh send to the vineyard to meet Ahab?,Yahweh sent Elijah the Tishbite to the vineyard.
21:18,t4af,,,0,What did Ahab do when Jezebel told him that Naboth was dead?,"When Ahab heard that Naboth was dead, he went to the vineyard to take possession of it."
21:19,piye,,,0,What did Elijah tell Ahab would happen to him because of his sin?,Elijah told Ahab that dogs would lick his blood where they had licked the blood of Naboth.
21:22,zc4l,,,0,What message did Elijah deliver to Ahab from Yahweh?,"Elijah told Ahab that Yahweh said his family will all be killed, because he had provoked Yahweh and caused Israel to sin."
21:23,iafx,,,0,What would happen to Jezebel?,The dogs would eat Jezebel by the rampart of Jezreel.
21:27,rbtc,,,0,What did Ahab do when he heard these words?,"Ahab tore his clothes, put sackcloth on his body, fasted and showed that he was sorry for the sins he had committed."
21:29,ecab,,,0,What did Yahweh do when Ahab humbled himself before him?,"Yahweh said that he would not bring this disaster in Ahab’s day, but would do it in his son’s day."
22:1,jpil,,,0,How long was there no war between Aram and Israel?,For three years there had been no war between Aram and Israel.
22:2,oupx,,,0,Who was the king of Judah?,The king of Judah was Jehoshaphat.
22:4,aj63,,,0,What did the king of Israel ask Jehoshaphat to do with him?,The king of Israel asked Jehoshaphat to go to Ramoth Gilead and make war on the king of Aram.
22:6,m0t5,,,0,Who did the king of Israel call together to seek the will of Yahweh in this matter?,"The king of Israel gathered the prophets, 400 men, and asked them about making war on Aram."
22:9,b6ik,,,0,From what other prophet did the king of Israel seek advice?,"The king of Israel called upon Micaiah, the son of Imiah."
22:12,bpkp,,,0,"As the kings Ahab and Jehoshaphat sat on their thrones before the prophets, what was the prophesy they heard?","As the kings Ahab and Jehoshaphat sat on their thrones, all the prophets said to them that they should attack Ramoth Gilead and win."
22:15,qmk0,,,0,Was Micaiah in agreement with all the other prophets?,"Yes, Micaiah was in agreement with all the other prophets."
22:17,stip,,,0,What bad news did Micaiah tell the king of Israel?,Micaiah told the king of Israel that they would have no shepherd and would be scattered.
22:21-23,hf1z,,,0,How did Micaiah tell the king of Israel that he would be enticed to go to Ramoth Gilead?,Micaiah told the king of Israel that he would be enticed to go to Ramoth Gilead by the lies his prophets would tell him.
22:26-27,o6n0,,,0,What did the king of Israel order to be done to Micaiah?,The king of Israel ordered that Micaiah be seized and put in prison and be fed only a little bread and water until the king of Israel returned safely.
22:30,horj,,,0,What did the king of Israel do to avoid capture in the battle at Ramoth Gilead?,The king of Israel disguised himself to avoid capture at Ramoth Gilead.
22:34,lko2,,,0,How did Ahab receive a serious wound at the battle of Ramoth Gilead?,"A soldier of Aram shot his bow at random and the arrow struck Ahab between the joints of his armor, wounding him."
22:37,d7te,,,0,Where was Ahab buried?,Ahab was buried in Samaria.
22:40,o7x7,,,0,Who became king at the death of Ahab?,His son Ahaziah became king of Israel.
22:42,rduv,,,0,How long did Jehoshaphat reign in Jerusalem?,Jehoshaphat reigned in Jerusalem for 25 years.
22:43,ucnv,,,0,What was said about the reign of Jehoshaphat?,It was said that Jehoshaphat did what was right in the eyes of Yahweh.
22:51-52,s56u,,,0,What was said about the reign of Ahaziah?,"It was said that Ahaziah did the evil things that his father and mother had done and the evil things that Jeroboam had done, leading the Israelite people to worship idols."
