Reference	ID	Tags	Quote	Occurrence	Question	Response
1:1-3	owce			0	What did Yahweh tell Joshua to do after the death of Moses?	Yahweh told Joshua to arise, cross the Jordan River with all the people, and go into the land he was giving to the sons of Israel.
1:5	ntge			0	Why did Yahweh say that no one would be able to stand against Joshua?	Yahweh said that no one would be able to stand against Joshua because Yahweh would be with Joshua just as he had been with Moses.
1:7	umky			0	What did Yahweh ask Joshua to do regarding the law of Moses?	Yahweh asked Joshua to be strong and very courageous, and to be careful to do according to all the law that Moses commanded, not turning from it to the right or to the left.
1:8	rk5v			0	What did Yahweh tell Joshua he should meditate on day and night?	Yahweh told Joshua that the book of the law should not depart from his mouth, but he should meditate on it day and night.
1:11	evy2			0	What did Joshua tell the officers of the people to command the people?	Joshua told the officers to command the people to prepare provisions for themselves because within three days they would cross the Jordan to possess the land Yahweh was giving them.
1:13	ae9h			0	What did Joshua remind the people that Moses had said Yahweh would give them?	Joshua reminded the people that Moses had said, “Yahweh your God is giving rest to you, and he will give to you this land.”
1:14	uyoh			0	What did Joshua tell the Reubenites, the Gadites, and half the tribe of Manasseh to do?	Joshua told them that their wives, children, and livestock could remain in the land Moses had given them east of the Jordan, but all their warriors, being armed, should cross over to help their brothers.
1:16	tsuq			0	How did the people answer Joshua’s commands?	The people answered Joshua by saying they would do all that he had commanded them and go wherever he sent them.
2:1	nua6			0	Where did the two spies stay when Joshua sent them to see the land and Jericho?	The two spies stayed at the house of a prostitute named Rahab in Jericho.
2:4	c19y			0	What did Rahab do with the two spies when the king of Jericho sent men to find them?	When the king’s men came to Rahab looking for the spies, she had hidden the spies, and she denied knowing where they were.
2:5	hxaq			0	What did Rahab tell the men from the king of Jericho about the spies?	Rahab told the king’s men that the spies had come to her, but she did not know where they were from, and they left at dark when the gate was about to shut. She told the men to pursue them quickly to overtake them.
2:9	bvtl			0	What reason did Rahab give the spies for why she had hidden them?	Rahab told the spies that she knew Yahweh had given them the land and that the dread of them had fallen on her people.
2:10	q1re			0	What reports had made Rahab believe Yahweh had given the Israelites the land?	Rahab said she believed Yahweh had given the Israelites the land because she had heard how Yahweh dried up the water of the Sea of Reeds for them and what they did to the two Amorite kings, Sihon and Og.
2:13	jva0			0	What did Rahab ask the spies to do for her and her family?	Rahab asked the spies to swear by Yahweh that they would keep her father, mother, brothers, sisters, and all their households alive and deliver them from death.
2:14	yh09			0	What did the spies promise Rahab?	The spies promised Rahab that their lives would be given in place of hers if she did not tell about their mission, and they would deal kindly and faithfully with her when Yahweh gave them the land.
2:18	sjfw			0	What did the spies tell Rahab she must do for her and her family to be safe when they came into the land?	The spies told Rahab to tie a scarlet cord in the window and gather her father, mother, brothers, and all her father’s household into her house.
2:24	rzdg			0	What did the spies report to Joshua when they returned?	The spies told Joshua that Yahweh had given all the land into their hand and that all the inhabitants of the land were melting because of them.
3:2-3	lnoj			0	What did the officers tell the people to do when they saw the Levite priests carrying the Box of the Covenant of Yahweh?	The officers told the people that when they saw the Box of the Covenant and the priests carrying it, they should set out from their place and follow it.
3:3-4	b05r			0	Why did the officers tell the people to stay about 2,000 cubits behind the Box of the Covenant of Yahweh?	The officers told the people to stay that far behind the Box of the Covenant so they would know the way to go, since they had not passed that way before.
3:5	t8xv			0	What did Joshua say Yahweh was going to do among the people the next day?	Joshua said that Yahweh was going to do wonders for the people the next day.
3:8	o9g3			0	What did Yahweh tell Joshua to command the priests carrying the Box of the Covenant when they reached the edge of the Jordan River?	Yahweh told Joshua to command the priests to stand still in the Jordan River once they reached the edge of its waters.
3:13	pl70			0	What did Joshua tell the people would happen when the soles of the feet of the priests carrying the Box of Yahweh rested in the waters of the Jordan?	Joshua told the people that as soon as the soles of the priests’ feet rested in the Jordan’s waters, the waters flowing from above would be cut off and stand in one heap.
3:16	v53o			0	Where did the people cross the Jordan River?	The people crossed the Jordan opposite Jericho, while the waters from above stood in a heap far away at Adam.
3:17	u449			0	What did the priests who carried the Box of the Covenant of Yahweh do while all Israel crossed the Jordan?	The priests who carried the Box of the Covenant stood firmly on dry ground in the middle of the Jordan River until all the nation had finished crossing.
4:3	twah			0	What did Yahweh tell Joshua to command 12 men (one from each tribe) to do?	Yahweh told Joshua to command the 12 men to take 12 stones from the middle of the Jordan, from where the priests’ feet stood, and carry them to their lodging place.
4:7	z1y3			0	What did Joshua say was the purpose of the 12 stones taken from the Jordan River?	The stones would be a memorial to the people of Israel forever, because the waters of the Jordan were cut off before the Box of the Covenant of Yahweh when it crossed.
4:13	q0ty			0	About how many armed warriors crossed over before Yahweh to the plains of Jericho for battle?	About 40,000 armed warriors crossed over before Yahweh to the plains of Jericho for battle.
4:18	kfnz			0	What happened when the priests who carried the Box of the Covenant of Yahweh came up out of the Jordan and their feet touched dry ground?	When the priests’ feet touched dry ground, the waters of the Jordan returned to their place and flowed over all its banks as before.
4:20	qicp			0	Where did Joshua set up the 12 stones that the men had taken out of the Jordan?	At Gilgal Joshua set up the 12 stones that came out of the Jordan.
4:24	ljkp			0	Why did Joshua say the people should tell their children what Yahweh had done for them at the Jordan?	Joshua said they should tell their children so that all the peoples of the earth might know Yahweh’s hand is mighty, and so that they might fear Yahweh their God all the days.
5:1	j4ux			0	What was the reaction of the Amorite and Canaanite kings when they heard Yahweh had dried up the Jordan’s waters for Israel?	When the kings heard how Yahweh had dried up the Jordan’s waters, their hearts melted, and there was no longer any spirit in them because of the sons of Israel.
5:2	ghz5			0	What did Yahweh command Joshua to make and do a second time for the sons of Israel?	Yahweh commanded Joshua to make flint knives and circumcise the sons of Israel a second time.
5:7	tyqk			0	Why did Joshua have to circumcise the sons of those who came out of Egypt?	Joshua had to circumcise them because they were uncircumcised, as they had not been circumcised while they were traveling in the wilderness.
5:10	rbcb			0	What festival did the sons of Israel celebrate while camped at Gilgal on the plains of Jericho?	While camped at Gilgal, the sons of Israel celebrated the Passover on the evening of the fourteenth day of the month.
5:12	z3d5			0	What food stopped the day after the people of Israel ate the produce of the land of Canaan?	The manna stopped the day after they ate the produce of the land, and the sons of Israel no longer had manna.
5:13	qrei			0	Who did Joshua see standing in front of him with a drawn sword when he was by Jericho?	Joshua saw a man standing in front of him with his drawn sword in his hand.
5:14	btkj			0	Who did the man with the drawn sword say he was?	The man with the drawn sword told Joshua that he had come as the commander of the army of Yahweh.
5:14	zt6z			0	What did Joshua ask the commander of Yahweh’s army?	Joshua fell on his face to the earth, bowed down, and asked what his lord was speaking to his servant.
5:15	fojd			0	What did the commander of Yahweh’s army tell Joshua to do because the place on which he was standing was holy?	The commander of Yahweh’s army told Joshua to remove his sandals from his feet because the place on which he was standing was holy.
6:2	sw2r			0	What did Yahweh promise Joshua concerning Jericho, its king, and its warriors?	Yahweh promised Joshua that he had given Jericho, its king, and its warriors into Joshua’s hand.
6:3	oaow			0	How were the men of war to circle the city of Jericho for six days?	All the men of war were to circle the city, going around it one time each day for six days.
6:4-5	wlqa			0	What did Yahweh tell Joshua should happen on the seventh day involving priests, shofars, and the people?	Yahweh told him that seven priests should carry seven shofars before the Box, and on the seventh day the people should circle the city seven times while the priests blew the shofars; then, at a long blast, all the people should shout.
6:5	k5ew			0	What did Yahweh say would happen to the city wall when the people shouted on the seventh day?	Yahweh said the wall of the city would collapse unto itself, and the people should go up, every man straight into the city.
6:10	du2y			0	What did Joshua command the people not to do until he told them to shout?	Joshua commanded the people not to shout, nor let their voice be heard, nor let a word go out of their mouth until the day he told them to shout.
6:17	ju5x			0	Who did Joshua say would live when the city of Jericho was devoted to Yahweh, and why?	Joshua said that only Rahab the prostitute and all who were with her in her house would live, because she hid the messengers they sent.
6:19	s5yy			0	What did Joshua declare was holy to Yahweh and must enter Yahweh’s treasury?	Joshua declared that all the silver, gold, and objects of bronze and iron were holy to Yahweh and must enter Yahweh’s treasury.
6:21	of2z			0	What did the people of Israel do to everything in the city after the walls of Jericho fell?	The people of Israel devoted to destruction by the sword all that was in the city—men and women, young and old, oxen, sheep, and donkeys.
6:22	gyhl			0	What did Joshua command the two men who had spied out the land to do regarding Rahab?	Joshua commanded the two spies to go into the prostitute’s house and bring her out, and all who belonged to her, as they had sworn to her.
6:26	p411			0	What curse did Joshua pronounce on the man who would rebuild Jericho?	Joshua said that the man who rebuilt Jericho would be cursed before Yahweh: he would lay its foundation with his firstborn and set up its gates with his youngest son.
7:1	c6fa			0	Why did Yahweh’s anger burn against the sons of Israel after Jericho?	Yahweh’s anger burned against the sons of Israel because Achan, from the tribe of Judah, took some of the devoted things.
7:3	nn2l			0	What did the spies who went to Ai report back to Joshua about its people?	The spies reported to Joshua not to make all the people go up, but that about 2,000 or 3,000 men should strike Ai, because its people were few.
7:5	tkib			0	What happened when about 3,000 men from Israel attacked Ai?	The men of Ai struck down about 36 of the Israelite men, pursued them from the gate to the quarries, and struck them on the descent.
7:6	dzxu			0	What did Joshua and the elders of Israel do until evening after the defeat at Ai?	Joshua tore his garments and fell on his face to the earth before the Box of Yahweh until evening, he and the elders of Israel; and they put dust on their heads.
7:11	fdz6			0	What did Yahweh tell Joshua was the reason Israel was defeated at Ai and could not stand before their enemies?	Yahweh told Joshua that Israel had sinned by transgressing his covenant, taking from the devoted things, stealing, deceiving, and putting it among their own things.
7:13	kkef			0	What did Yahweh tell Joshua to do to prepare the people for the next day?	Yahweh told Joshua to arise, consecrate the people, and tell them to consecrate themselves for the next day because there was a devoted thing in their midst.
7:15	n4u0			0	What did Yahweh say would happen to the one caught with the devoted thing?	Yahweh said that the one caught with the devoted thing, he and all that belonged to him, would be burned with fire, because he transgressed Yahweh’s covenant and did a disgraceful thing in Israel.
7:21	hyf3			0	What items did Achan confess to Joshua that he had taken from the spoil?	Achan confessed he had taken a good coat from Shinar, 200 shekels of silver, and a wedge of gold weighing 50 shekels.
7:21	gepd			0	Where did Achan tell Joshua he had hidden the things he had taken?	Achan told Joshua he had hidden them in the earth in the middle of his tent, with the silver underneath.
7:24	eh9a			0	Where did Joshua and all Israel take Achan, his family, his possessions, and the stolen items?	Joshua and all Israel took Achan and all that he had to the Valley of Achor.
7:26	uavi			0	What happened to Yahweh’s burning anger after Achan and his household were stoned and burned?	After Achan was dealt with, Yahweh turned from his burning anger.
8:1-2	krzn			0	What instructions did Yahweh give Joshua for attacking Ai, including what to do with its spoil?	Yahweh told Joshua not to fear, to take all the men of war, go up to Ai, set an ambush behind the city, and do to Ai and its king as he did to Jericho, but they could take its spoil and livestock for themselves.
8:2	ml6z			0	What were the people of Israel allowed to do with the spoil and livestock from Ai, unlike Jericho?	Yahweh told the people they could plunder the spoil and livestock of Ai for themselves.
8:3	eu01			0	How many warriors did Joshua choose and send by night for the ambush of Ai?	Joshua chose 30,000 men, warriors of valor, and sent them out by night.
8:5	kgcz			0	What was Joshua’s plan for his main forces when they approached Ai and the men of Ai came out?	Joshua planned that he and all the people with him would approach the city, and when the men of Ai came out to meet them as before, they would flee.
8:8	j4r1			0	What were Joshua’s men in ambush to do to the city once they captured it, according to Yahweh’s word?	When the men captured the city, they were to burn it with fire, according to the word of Yahweh.
8:15-17	akaz			0	What did all the people of Ai and Bethel do when Joshua and his army pretended to be beaten and fled toward the wilderness?	All the people in Ai were summoned to pursue Joshua’s army; they pursued Joshua, were drawn away from the city, and left the city open, as did the men of Bethel.
8:18	hcc9			0	What signal did Yahweh tell Joshua to give with his curved sword to initiate the ambush?	Yahweh told Joshua to stretch out the curved sword in his hand toward Ai, because he would give it into Joshua’s hand.
8:23	p7v3			0	Who did the men of Israel capture alive from Ai and bring to Joshua?	The men of Israel captured the king of Ai alive and brought him to Joshua.
8:26	rzkw			0	How long did Joshua keep his hand stretched out with the curved sword?	Joshua did not draw back his hand with which he stretched out the curved sword until he had devoted all the inhabitants of Ai.
8:27	ynx0			0	What did Israel plunder for themselves from Ai, according to Yahweh’s command to Joshua?	Israel plundered the livestock and the spoil of Ai for themselves, according to the word of Yahweh which he had commanded Joshua.
8:29	zzaf			0	What did Joshua do with the king of Ai after hanging him on a tree until evening?	As the sun was going down, Joshua commanded, and they took his corpse down from the tree, threw it at the entrance of the city gate, and raised over it a great pile of stones.
9:2	x4zx			0	What did the kings beyond the Jordan in the hill country, the lowlands, and the coast of the Great Sea do when they heard about Israel’s victories?	The kings gathered themselves together as one to fight against Joshua and against Israel.
9:3-4	ojcv			0	Which inhabitants acted with cunning when they heard what Joshua had done to Jericho and Ai?	The inhabitants of Gibeon acted with cunning when they heard what Joshua had done to Jericho and Ai.
9:4-5	y516			0	How did the Gibeonite envoys disguise themselves and their provisions to appear as if from a distant land?	They took worn-out sacks, worn-out and mended wine skins, wore worn-out and patched sandals and garments, and took dry, crumbly bread.
9:6	d6cz			0	What did the Gibeonites tell Joshua and the men of Israel they had come from when they arrived at Gilgal?	The Gibeonites told Joshua and the men of Israel that they had come from a distant land.
9:6	eiv4			0	What did the Gibeonites ask Joshua and the men of Israel to do?	The Gibeonites asked the men of Israel to make a covenant with them.
9:14	dwlk			0	What did the Israelite men fail to do before taking the Gibeonites’ provisions and making a covenant?	The Israelite men took some of their provisions but did not ask for the mouth (counsel) of Yahweh.
9:15	g7bh			0	What did Joshua do with the Gibeonites, and what did the leaders of the congregation do?	Joshua made peace with them and made a covenant with them to let them live, and the leaders of the congregation swore to them.
9:16	y3bp			0	What did the Israelites learn about the Gibeonites three days after making the covenant?	The Israelites learned that the Gibeonites were their neighbors and lived among them.
9:19	i1b2			0	Why did all the leaders say the Israelites could not attack the Gibeonites?	The leaders said they could not touch the Gibeonites because they had sworn to them by Yahweh, the God of Israel.
9:24	xh4i			0	What reason did the Gibeonites give Joshua for deceiving the Israelites?	The Gibeonites said they deceived the Israelites because it was declared to them that Yahweh had commanded Moses to give Israel all the land and destroy its inhabitants, and they were very afraid for their lives.
9:26-27	tsdv			0	What did Joshua decree concerning the Gibeonites, saving them from death but making them serve Israel?	Joshua delivered them from the hand of the sons of Israel so they did not kill them, but he made them cutters of wood and drawers of water for the congregation and for the altar of Yahweh.
10:2	rezg			0	Why did Adoni Zedek, king of Jerusalem, and his people fear greatly when they heard Gibeon made peace with Israel?	They feared greatly because Gibeon was a great city, like one of the royal cities, larger than Ai, and all its men were warriors.
10:4	xo1z			0	What did Adoni Zedek, king of Jerusalem, ask the kings of Hebron, Jarmuth, Lachish, and Eglon to do?	He asked them to come up to him and help him so they could strike Gibeon, because it had made peace with Joshua and Israel.
10:5	x0xc			0	What did the five Amorite kings (of Jerusalem, Hebron, Jarmuth, Lachish, and Eglon) and their armies do?	The five Amorite kings and all their camps gathered and went up; they camped against Gibeon and fought against it.
10:6	tq5k			0	What message did the men of Gibeon send to Joshua at the camp in Gilgal?	The men of Gibeon sent to Joshua, asking him not to withdraw his hand from them, but to come up quickly, save them, and help them, because all the Amorite kings from the hill country had gathered against them.
10:8	ougn			0	What did Yahweh say to Joshua regarding the five Amorite kings and their armies?	Yahweh told Joshua not to be afraid of them, because he had given them into Joshua’s hand, and not a man from them would stand before him.
10:11	txsd			0	How did Yahweh cause more of the fleeing Amorites to die than the Israelites killed with the sword?	As they fled, Yahweh threw great stones from the heavens on them as far as Azekah, and they died; more died from the hailstones than the sons of Israel killed with the sword.
10:12	pi2y			0	What did Joshua say in the sight of Israel on the day Yahweh gave the Amorites into their hands?	He said in the sight of Israel, “Sun, be still over Gibeon, and moon, over the Valley of Aijalon.”
10:16	r3zx			0	Where did the five Amorite kings flee and hide themselves?	The five kings fled and hid themselves in the cave at Makkedah.
10:20	e3in			0	What happened to most of the armies of the five Amorite kings?	Joshua and the sons of Israel finished striking them with a very great slaughter until they were finished, and the survivors entered the fortified cities.
10:26-27	d4yp			0	What did Joshua do with the five Amorite kings after bringing them out of the cave at Makkedah?	Joshua struck them, killed them, and hanged them on five trees until evening; then, at sunset, they were taken down, thrown into the cave where they had hidden, and great stones were placed over the cave’s mouth.
10:40	ejb8			0	What did Joshua do to all the land (hill country, Negev, lowland, slopes) and its kings?	Joshua struck all the land and all their kings; he left no survivor but devoted every breathing thing, as Yahweh, the God of Israel, had commanded.
10:42	e3n7			0	Why was Joshua able to capture all these kings and their land at one time?	Joshua was able to capture all these kings and their land at one time because Yahweh, the God of Israel, fought for Israel.
11:1	n9xb			0	What did Jabin, king of Hazor, do when he heard about Israel’s victories?	When Jabin, king of Hazor, heard, he sent to Jobab king of Madon, to the king of Shimron, to the king of Achshaph, and to other northern kings.
11:5	xbip			0	Where did all these northern kings and their many armies meet and camp to fight against Israel?	All these kings met together and came and camped together at the waters of Merom to fight with Israel.
11:6	p12d			0	What did Yahweh tell Joshua not to fear and what to do to their horses and chariots?	Yahweh told Joshua not to be afraid of them, for the next day he would give them all slain to Israel; Joshua was to hamstring their horses and burn their chariots with fire.
11:11	zvd1			0	What did Joshua’s army do to every person in Hazor and to the city itself?	They struck every person in Hazor with the edge of the sword, devoting them; not any breathing thing remained, and Joshua burned Hazor with fire.
11:12	nun0			0	What did Joshua do with all the cities of these northern kings and all their kings?	Joshua captured all the cities of these kings and all their kings, and he struck them with the edge of the sword, devoting them, just as Moses the servant of Yahweh had commanded.
11:15	pr7s			0	How completely did Joshua follow the commands Yahweh had given Moses, and Moses had given him?	Just as Yahweh had commanded Moses his servant, so Moses had commanded Joshua, and thus Joshua did; he did not turn aside a thing from all that Yahweh had commanded Moses.
11:19	b31q			0	Which city was the only one, apart from the Hivite dwellers of Gibeon, that made peace with the sons of Israel?	There was not a city that made peace with the sons of Israel except the Hivites, the dwellers of Gibeon; they captured all of them in battle.
12:1	dhyn			0	Which kings of the land on the east side of the Jordan did the sons of Israel strike and possess their land?	The sons of Israel struck Sihon king of the Amorites and Og king of Bashan and possessed their land on the east side of the Jordan.
12:6	glxt			0	Who had led the sons of Israel in defeating these kings on the east side of the Jordan, and to whom was their land given?	Moses, the servant of Yahweh, and the sons of Israel had struck them; and Moses gave their land as a possession to the Reubenites, the Gadites, and the half-tribe of Manasseh.
12:7	eavg			0	Who led the sons of Israel in defeating the kings on the west side of the Jordan, and to whom was their land given?	Joshua and the sons of Israel struck the kings on the west side of the Jordan, and Joshua gave their land to the tribes of Israel as a possession according to their divisions.
12:24	dx6v			0	How many kings in total did Joshua and the sons of Israel strike on the west side of the Jordan?	All the kings on the west side of the Jordan were 31.
13:1	k69i			0	What did Yahweh tell Joshua when Joshua was old and advanced in days?	Yahweh told Joshua that he had aged and come into days, and very much land still remained to be possessed.
13:6	f5qq			0	What did Yahweh say he himself would do to the inhabitants of the hill country from Lebanon to Misrephoth Maim, and what was Joshua to do with that land?	Yahweh said he himself would dispossess them from before the sons of Israel, and Joshua was to cause it to fall to Israel as an inheritance.
13:7	thiu			0	Among which tribes was Joshua to divide the remaining land as an inheritance?	Joshua was to divide the land as an inheritance to the nine tribes and the half-tribe of Manasseh.
13:8	c2qa			0	Which tribes had already received their inheritance from Moses on the east side of the Jordan?	With the other half of Manasseh, the Reubenites and the Gadites had taken their inheritance that Moses gave them on the other side of the Jordan eastward.
13:14	zozg			0	Which tribe did Moses not give an inheritance of land to?	Moses did not give an inheritance to the tribe of Levi.
