Reference	ID	Tags	Quote	Occurrence	Question	Response
13:14	vnwp			0	What was the inheritance of the tribe of Levi, since Moses did not give them land?	Their inheritance was the burnt offerings of Yahweh, the God of Israel, just as he spoke to them.
13:23	w0gg			0	What geographical feature formed the border of the inheritance of the sons of Reuben?	The Jordan River and its border formed the border of the inheritance of the sons of Reuben.
14:4	jetd			0	The sons of Joseph became which two tribes, who received land, while the Levites received cities?	The sons of Joseph became two tribes, Manasseh and Ephraim; and they gave no portion to the Levites in the land except cities to dwell in and pasturelands.
14:6-7	udx7			0	How old was Caleb when Moses sent him from Kadesh Barnea to spy out the land?	Caleb was 40 years old when Moses, the servant of Yahweh, sent him from Kadesh Barnea to spy on the land.
14:9	fh59			0	What did Moses swear on that day concerning the land Caleb’s foot had trodden?	Moses swore that the land on which Caleb’s foot had trodden would be an inheritance for Caleb and his sons forever, because he was full after Yahweh his God.
14:10	ifqn			0	How old was Caleb when he spoke to Joshua about his inheritance, 45 years after Yahweh spoke to Moses?	Caleb was 85 years old at that time.
14:12	xp2z			0	What specific hill country did Caleb ask Joshua to give him, which Yahweh had spoken of, where Anakites and fortified cities were?	Caleb asked Joshua to give him the hill country that Yahweh spoke of on that day, where the Anakites were with great fortified cities.
15:1	l2mn			0	Where was the lot for the tribe of Judah according to their clans, extending southward?	The lot for the tribe of Judah was to the border of Edom, from the wilderness of Zin southward from the end of the south.
15:5	jk0k			0	What was the eastern border for the tribe of Judah?	The eastern border for the tribe of Judah was the Sea of Salt, up to the end of the Jordan River.
15:12	tzni			0	What was the western border for the clans of the sons of Judah?	The western border for the clans of the sons of Judah was the Great Sea and its border.
15:19	fkte			0	What did Caleb give his daughter Achsah in addition to the land of the Negev when she asked for a blessing?	When Achsah asked for springs of water, Caleb gave her the upper springs and the lower springs.
15:63	ld4x			0	Which people, dwelling in Jerusalem, were the sons of Judah not able to dispossess?	The sons of Judah were not able to dispossess the Jebusites, the dwellers of Jerusalem, so the Jebusites have dwelled with the sons of Judah in Jerusalem to this day.
16:4	rjbw			0	Which two tribes, the sons of Joseph, inherited land?	The sons of Joseph, Manasseh and Ephraim, inherited land.
16:10	il4a			0	Which Canaanite dwellers of Gezer did the Ephraimites not dispossess, who then lived among them as forced laborers?	The Ephraimites did not dispossess the Canaanite dwellers of Gezer, so the Canaanites have dwelled within Ephraim to this day but have become serving forced laborers.
17:1	d29r			0	Who was the firstborn of Joseph, to whom a lot was given?	Manasseh was the firstborn of Joseph, and a lot was given to him.
17:1	f6pt			0	Who was Machir, the firstborn of Manasseh and father of Gilead, and what did he receive because he was a man of war?	Machir was the firstborn of Manasseh and father of Gilead; because he was a man of war, Gilead and Bashan were given to him.
17:3-4	rekk			0	Why did the daughters of Zelophehad approach Eleazar, Joshua, and the leaders?	The daughters of Zelophehad approached them because their father had no sons, and Yahweh had commanded Moses to give them an inheritance among their father’s brothers.
17:4	ojke			0	What did Joshua (Eleazar and the leaders) give to the daughters of Zelophehad according to Yahweh’s command?	They gave them an inheritance in the midst of the brothers of their father, according to the command of Yahweh.
17:13	bmfe			0	What did the sons of Israel do to the Canaanites when they became strong, though they did not dispossess them?	When the sons of Israel became strong, they put the Canaanites to forced labor, but they did not dispossess them.
17:14	ithw			0	What did the sons of Joseph say to Joshua about their inheritance, since they were a numerous people blessed by Yahweh?	The sons of Joseph asked Joshua why he had given them only one lot and one portion as an inheritance, when they were a numerous people whom Yahweh had blessed.
17:15	lnwc			0	What did Joshua tell the numerous sons of Joseph to do if the hill country of Ephraim was too narrow for them?	Joshua told them that if they were a numerous people, they should go up to the forest and clear land for themselves there in the land of the Perizzites and the Raphaites.
18:2	o26a			0	How many tribes remained among the sons of Israel which had not yet occupied any land?	Seven tribes remained among the sons of Israel which had not yet divided their inheritance.
18:4	fo2e			0	What did Joshua instruct each of the seven remaining tribes to provide for surveying the land?	Joshua instructed them to provide three men from each tribe to arise and walk about in the land and write down a description of it.
18:4	tatb			0	What were the men sent to survey the land supposed to write down and bring back to Joshua?	They were to write down a description of the land according to their inheritance and then come back to Joshua.
18:10	ifoe			0	What did Joshua do at Shiloh before Yahweh after the surveyors returned, to divide the land for the remaining tribes?	Joshua threw a lot for them in Shiloh before Yahweh, and there Joshua divided the land to the sons of Israel according to their divisions.
18:11	k93x			0	Between which two tribes’ territories did the lot for the tribe of Benjamin fall?	The border of the lot for the tribe of Benjamin went out between the sons of Judah and between the sons of Joseph.
19:1	hhzh			0	To which tribe, according to their clans, did the second lot come out?	The second lot came out for Simeon, for the tribe of the sons of Simeon according to their clans.
19:9	xkw4			0	From which tribe’s portion was the inheritance of the sons of Simeon taken?	The leaders of Israel had assigned more land to the tribe of Judah than it needed, so they gave part of that land to the tribe of Simeon.
19:9	ny65			0	Why was the inheritance of Simeon taken from Judah’s portion?	It was taken from Judah’s portion because the division of the sons of Judah was too great for them, so the sons of Simeon inherited in the midst of their inheritance.
19:10	zrtz			0	To which tribe, according to their clans, did the third lot come up?	The third lot came up for the sons of Zebulun according to their clans.
19:17	h9yv			0	To which tribe, according to their clans, did the fourth lot come out?	Joshua threw the lot again, and this time it selected the clans of the tribe of Issachar to receive the fourth part of the land.
19:24	i5oi			0	To which tribe, according to their clans, did the fifth lot come out?	Joshua threw the lot again, and this time it selected the clans of the tribe of Asher to receive the fifth part of the land.
19:32	thqg			0	When Joshua threw the lot again, which tribe did it select to receive the sixth part of the land?	The sixth lot came out for the sons of Naphtali, for the sons of Naphtali according to their clans.
19:38	tmx4			0	How many fortified cities and their villages were included in the inheritance of the tribe of Naphtali?	The inheritance of the tribe of Naphtali included 19 cities and their villages.
19:40	hh7n			0	To which tribe, according to their clans, did the seventh lot come out?	The seventh lot came out for the tribe of the sons of Dan according to their clans.
19:49-50	ou2v			0	What city did the sons of Israel give to Joshua son of Nun as an inheritance in their midst, upon Yahweh’s command?	Upon the mouth of Yahweh, they gave him the city that he requested, Timnath Serah in the hill country of Ephraim.
20:2	lbe3			0	What did Yahweh tell Joshua to instruct the sons of Israel to designate, as spoken by Moses?	Yahweh told Joshua to instruct the sons of Israel to choose some cities to which people can flee in order to be safe, as he spoke to them by the hand of Moses.
20:3	ebgj			0	For whom were the cities of refuge intended as a sanctuary?	They were intended for the one killing by striking a person by mistake without intent, to be a refuge from the avenger of blood.
20:4	tz6b			0	What was a person who fled to a city of refuge to do at the entrance of the city gate, and how were the elders to respond?	The person was to stand at the entrance of the city gate and speak his words in the ears of the elders of that city; they were to gather him into the city and give him a place to dwell with them.
20:6	gnil			0	How long was the one who killed someone by mistake to dwell in the city of refuge before returning to his own city and house?	He was to dwell in that city until his standing before the congregation for judgment, and he must still stay there until the current high priest dies.
21:1-2	emvg			0	What did the heads of the fathers of the Levites ask Eleazar, Joshua, and the heads of the Israelite tribes at Shiloh?	They asked for cities to dwell in, with their pasturelands for their livestock, as Yahweh had commanded by the hand of Moses.
21:8	jfcv			0	How did the sons of Israel give cities and pasturelands to the Levites from their inheritance?	The sons of Israel gave these cities and their pasturelands to the Levites by lot from their inheritance, just as Yahweh had commanded by the hand of Moses.
21:18-19	s9xt			0	How many cities in total, from the tribes of Judah, Simeon, and Benjamin, were given by lot to the sons of Aaron the priest?	All the cities of the sons of Aaron, the priests, were 13 cities and their pasturelands.
21:26	bw0i			0	How many cities in total, from Ephraim, Dan, and half-Manasseh, were given to the remaining clans of the sons of Kohath?	There were ten cities in all, together with their surrounding fields, that these other clans that were descendants of Kohath received.
21:33	gfik			0	How many cities in total, from half-Manasseh (in Bashan), Issachar, Asher, and Naphtali, were given to the clans of Gershon?	Altogether, the Gershonite clans received 13 cities, together with their surrounding fields.
21:40	zhnh			0	How many cities in total, from Zebulun, Reuben, and Gad, were given by lot to the clans of Merari, the remaining Levites?	In all, this last group of Levite clans, the ones that were descendants of Merari, received 12 cities when the Israelite leaders cast lots for them.
21:41	i54g			0	How many cities in total, with their pasturelands, did the Levites receive in the midst of the possession of the sons of Israel?	All the cities of the Levites in the midst of the possession of the sons of Israel were 48 cities and their pasturelands.
21:44	d026			0	What did Yahweh give to Israel from all around, according to all he had sworn to their fathers, and what happened to their enemies?	Yahweh gave rest to them from all around, according to all that he had sworn to their fathers. None of their enemies were able to fight against them and defeat them. Instead, Yahweh helped Israel defeat all their enemies.
22:3	wgdg			0	What did Joshua commend the Reubenites, Gadites, and half-tribe of Manasseh for having kept for many days?	Joshua commended them for not forsaking their fellow Israelites but having kept everything that Yahweh their God taught them and commanded them to do.
22:8	rx9y			0	What did Joshua tell the departing tribes (Reuben, Gad, half-Manasseh) to do with the great spoil of their enemies?	Joshua told them to return to their tents with many riches, livestock, silver, gold, bronze, iron, and garments, and to divide the spoil of their enemies with their brothers.
22:11	qhec			0	What did the sons of Israel hear that the Reubenites, Gadites, and half-tribe of Manasseh had built near the Jordan in Canaan?	The sons of Israel heard that these tribes had built an altar at the front of the land of Canaan, in the regions of the Jordan, on the side of the sons of Israel.
22:12	n9mr			0	What did the whole congregation of the sons of Israel do at Shiloh when they heard about the altar?	The whole congregation of the sons of Israel gathered themselves at Shiloh to go up against them to war.
22:13	k2zq			0	Who did the sons of Israel send to the land of Gilead to speak with the tribes of Reuben, Gad, and half-Manasseh?	The sons of Israel sent Phinehas, the son of Eleazar the priest, to the land of Gilead.
22:16	zna0			0	What accusation of unfaithfulness did the whole congregation of Yahweh make against the tribes who built the altar?	They asked what unfaithfulness these tribes had committed against the God of Israel, to turn away from Yahweh by building an altar for themselves in rebellion against Yahweh.
22:18	j6ch			0	What did the messengers fear would happen tomorrow if these tribes rebelled against Yahweh today?	They feared that if these tribes rebelled against Yahweh today, then tomorrow Yahweh would be furious toward all the congregation of Israel.
22:27	x9m1			0	Regarding future generations, what did the tribes of Reuben, Gad, and half-Manasseh say was the purpose of building the altar?	They said they built the altar to be a witness between them and the other tribes, and between their future generations, to serve Yahweh with their offerings, so their sons would not tell the other tribes’ sons they had no portion in Yahweh.
22:30	k6st			0	How did Phinehas the priest and the leaders of the congregation react to the explanation given by these tribes about the altar?	When Phinehas the priest and the leaders heard their words, it was good in their eyes.
22:33	ucrr			0	What was the reaction of the sons of Israel when Phinehas and the leaders reported the explanation for the altar?	The word was good in the eyes of the sons of Israel; they blessed God and did not speak of going up against them to war to destroy their land.
23:2	h17v			0	What did Joshua do when he had aged and come into days, having Yahweh given Israel rest?	Joshua called to all of Israel, to its elders, heads, judges, and officers, and spoke to them.
23:3	tnpo			0	Who did Joshua remind the people had fought for them against all the nations?	Joshua reminded them that Yahweh their God was the one who had fought for them.
23:7	vsl5			0	What did Joshua warn the people not to do regarding the nations remaining among them and their gods?	Joshua warned them not to come among these nations, nor invoke the name of their gods nor swear by them nor serve them nor bow down to them.
23:14	ie7a			0	What did Joshua, knowing he was about to die, affirm about all the good words Yahweh had spoken concerning Israel?	He affirmed that Yahweh he has done every single thing he promised to do for you.
23:16	ts92			0	What did Joshua warn would happen if the people transgressed Yahweh’s covenant by serving and bowing to other gods?	Joshua warned that if they did so, Yahweh’s anger would burn against them, and very soon none of them would be living in the good land that he gave them.
24:1	b6mp			0	Where did Joshua gather all the tribes of Israel, and who presented themselves before God?	Joshua gathered all the tribes of Israel to Shechem, and he called to the elders of Israel, its heads, judges, and officers, and they presented themselves before God.
24:13	ze9k			0	What did Yahweh say, through Joshua, he had given to the people of Israel that they did not labor for, build, or plant?	Yahweh said he had given them land for which they had not labored, cities they had not built (but dwelled in), and vineyards and olive groves they did not plant (but ate from).
24:15	ifh2			0	Whom did Joshua declare that he and his house would serve, regardless of the people’s choice?	Joshua declared that he and his house would serve Yahweh.
24:18	dce7			0	How did the people respond to Joshua’s challenge, affirming their commitment to serve Yahweh?	The people said, “We ourselves will serve Yahweh, for he is our God.”
24:20	arct			0	What did Joshua warn would happen if Israel forsook Yahweh and served foreign gods, even after Yahweh had done good to them?	Joshua warned that if they forsook Yahweh and served foreign gods, then Yahweh would turn and do harm to them and destroy them, even after he has done such good things for them.
24:24	wq69			0	What was the people’s final declaration to Joshua regarding serving Yahweh and listening to his voice?	The people said to Joshua, “We will serve Yahweh our God, and we will listen to his voice.”
24:26	w2ty			0	What did Joshua do to formalize the covenant, and where did he set up a great stone?	Joshua wrote these words in the book of the instruction of God, took a great stone, and set it up there beneath the oak tree that was at the Holy Place of Yahweh.
24:27	w47s			0	What did Joshua say the great stone would be a witness against them for, lest they deal falsely with their God?	Joshua told all the people, “Look! This stone will always be for a witness against us. This is the place where I told you what Yahweh wanted to say to you {and you promised that you would serve him}. This stone will remind you of your promise so that you are not disloyal to God.”
24:29	hgqm			0	How old was Joshua, the servant of Yahweh, when he died?	Joshua, the son of Nun, the servant of Yahweh, died at the age of 110 years.
24:32	nn52			0	Whose bones, brought up from Egypt by the sons of Israel, did they bury in Shechem?	The sons of Israel buried the bones of Joseph, which they had brought up from Egypt, in Shechem.
