Reference	ID	Tags	Quote	Occurrence	Question	Response
1:2	rxnu			0	Who would lead the people of Israel when they went up against the Canaanites to fight against them?	Judah would lead the people of Israel against the Canaanites to fight against them.
1:5	cciw			0	Against whom did the soldiers of Judah fight?	The soldiers of Judah fought against the Canaanites, the Perizzites, and Adoni-Bezek.
1:7	fe58			0	Who gathered their food from under Adoni-Bezek’s table?	Seventy kings, who had their thumbs and their big toes cut off, gathered their food from beneath Adoni-Bezek’s table.
1:10	ntzn			0	What was the previous name of Hebron?	The name of Hebron was previously Kiriath Arba.
1:13	uct9			0	What did Caleb give to Othniel?	Caleb gave Achsah, his daughter, to be Othniel’s wife.
1:15	f9oy			0	Since Achsah was given land in the Negev, what did she want her father to give her?	Since Achsah now had land in the Negev, she wanted him to give her springs of water.
1:16	sjw4			0	Where is the wilderness of Judah?	The wilderness of Judah is in the Negev.
1:19	ofm8			0	Why could the people of Judah not drive out the dwellers of the valley?	They could not drive out the dwellers of the valley because they had iron chariots.
1:21	sdu5			0	Why did the Jebusites live with the people of Benjamin in Jerusalem?	Because the people of Benjamin did not drive out the Jebusites who inhabited Jerusalem, the Jebusites lived with the people of Benjamin in Jerusalem.
1:25	oj2h			0	What happened to the man who showed the spies from the house of Joseph how to get into Bethel?	The spies let the man and his family get away.
1:28	z5s6			0	When Israel became strong, what did they do to the Canaanites?	When Israel became strong, they forced the Canaanites to serve them with hard labor, but they never drove them out completely.
1:32	lwez			0	Why did the tribe of Asher live among the Canaanites?	The tribe of Asher lived among the Canaanites because they did not drive the Canaanites out of the land.
1:35	ml1t			0	Who conquered the Amorites at Mount Heres, in Aijalon, and in Shaalbim?	The house of Joseph conquered them.
2:1	btmw			0	Where did the angel of Yahweh bring the people of Israel?	The angel of Yahweh brought them to the land he swore to give to their fathers.
2:4	r08t			0	When the angel said he would not drive the Canaanites out before the people of Israel, what did they do?	When the angel said he would not drive the Canaanites out before the people of Israel, they cried out and wept.
2:7	tq1t			0	How long did the people serve Yahweh?	The people served Yahweh during the lifetimes of Joshua and of the elders who outlived him.
2:12	ki7r			0	What gods did the people of Israel go after?	The people of Israel went after the gods of the peoples who were around them.
2:15	nw5v			0	What had Yahweh sworn to Israel?	Yahweh had sworn that wherever Israel went out to fight, Yahweh would allow their enemies to defeat them.
2:16	yjrx			0	What did the judges do?	The judges saved the people of Israel from the power of those who were stealing their possessions.
2:19	ky9w			0	What happened when the judge died?	When the judge died, the people of Israel would turn away and do things that were even more corrupt than their fathers had done.
2:22	x5yy			0	Why would Yahweh not drive out from Israel any of the nations that Joshua left when he died?	Yahweh would not drive out from Israel any of the nations that Joshua left when he died, so that Yahweh could test Israel to see whether or not they would do what Yahweh wanted them to do as their ancestors had.
3:1	zoo6			0	Why did Yahweh leave nations to test Israel?	Yahweh left nations to test Israel to teach warfare to the new generation of the Israelites who had not known it before.
3:4	jjnm			0	What would Yahweh do by means of the remaining nations?	Yahweh would test Israel by means of the remaining nations to confirm whether they would obey the commandments he gave their ancestors through Moses.
3:7	rlje			0	What did the people of Israel serve?	They served the Baals and the Asherahs.
3:9	y8jl			0	Who did Yahweh first raise up, who would come to help the people of Israel?	Yahweh first raised up Othniel, the son of Kenaz, Caleb’s younger brother.
3:12	omwr			0	Who gave strength to Eglon, the king of Moab?	Yahweh gave strength to Eglon, the king of Moab.
3:15	nc6z			0	When did Yahweh raise up Ehud to help the people of Israel?	Yahweh raised up Ehud to help the people of Israel when they cried out to him for help.
3:16	mglj			0	Where did Ehud strap on the sword he made?	He strapped it on under his clothing on his right thigh.
3:20	e1qq			0	Who was with Ehud and the king when Ehud told him the message?	Only Ehud and the king were there.
3:22	hwhd			0	Why did fat close over the handle of the sword?	Fat closed over the handle because Ehud did not draw the sword out of the king’s body.
3:24	bqhn			0	When the king’s servants saw that the doors of the upper room were bolted, what did they think?	When the king’s servants saw that the doors of the upper room were bolted, they thought he was relieving himself in the coolness of the upper room.
3:26	x647			0	When did Ehud escape?	While the servants were waiting, wondering what they should do, Ehud escaped.
3:28	h8p8			0	How did the people of Israel prevent the Moabites from crossing the river?	The people of Israel captured the fords of the Jordan across from the Moabites.
3:31	nyif			0	With what did Shamgar kill 600 Philistines?	Shamgar killed the Philistines with a stick used to goad the cattle.
4:3	b15e			0	Why did the people of Israel call out to Yahweh for help?	The people of Israel called out to Yahweh for help because Sisera had 900 iron chariots and he had been oppressing the people of Israel for 20 years.
4:5	ohfp			0	Why did the people of Israel come to Deborah?	The people of Israel came to Deborah to settle their disputes.
4:7	ms4g			0	Where would Yahweh make Sisera meet Barak?	Yahweh would make Sisera meet Barak by the river of Kishon.
4:9	hyex			0	Why would Yahweh make a woman defeat Sisera?	Yahweh would make a woman defeat Sisera because Barak would not go without Deborah.
4:11	fx2l			0	From whom did the Kenites descend?	The Kenites descended from Hobab, Moses’ father-in-law.
4:16	klih			0	How many of the army of Sisera survived?	None of the army of Sisera survived.
4:17	lf7a			0	Why did Sisera go to the tent of Jael?	Sisera went to the tent of Jael because there was peace between Jabin the king of Hazor, and the house of Heber, Jael’s husband.
4:19	dv9s			0	When Sisera asked for water, what did Jael give him?	When Sisera asked for water, Jael gave him milk.
4:21	sw16			0	How did Jael kill Sisera?	Jael hammered the tent peg into the side of his head and it pierced through him and went down into the ground.
5:4	xl77			0	When did the earth shake?	The earth shook when Yahweh went out from Seir, when he marched from Edom.
5:8	ue4f			0	What was not seen among 40,000 in Israel?	Neither shields nor spears were seen among 40,000 in Israel.
5:10	lkwt			0	What things were used as saddles on the white donkeys?	Carpets were used as saddles on the white donkeys.
5:13	le8v			0	Why did the people of Yahweh come down?	The people of Yahweh came down to help Barak fight against the warriors.
5:18	o6q3			0	What would Zebulun risk?	The people of Zebulun would risk their lives to the point of death.
5:20	jm7o			0	What fought against Sisera from their courses across the heavens?	The stars fought against Sisera as they moved across the heavens.
5:23	rpf0			0	Why did the angel of Yahweh curse Meroz?	The angel of Yahweh cursed Meroz because they did not come to help Yahweh.
5:26	d5ng			0	To what did Jael put her hand?	In one hand she took the tent peg and in her other hand, a workman’s hammer.
5:28	p4ht			0	Where did the mother of Sisera look out?	The mother of Sisera looked out of a window through the lattice.
5:31	uww9			0	Like what should those who love Yahweh be?	Those who love Yahweh should be as strong as the sun when it rises.
6:2	urz2			0	What did the people of Israel do because of Midian?	To hide from the cruelty of Midian, the people of Israel made dens and caves in the mountains to live in.
6:3	zj0x			0	What happened any time the Israelites planted their crops?	Any time the Israelites planted their crops, the Midianites, the Amalekites, and the people from the east would attack the Israelites.
6:5	h44e			0	How many Midianites and Amalekites would attack?	So many Midianites and Amalekites would attack that it was impossible to count them.
6:10	iucq			0	In whose land were the people of Israel living?	They were living in the land of the Amorites.
6:11	vcup			0	Why was Gideon separating out the wheat by beating it on the floor in the winepress?	Gideon was working in the winepress in order to hide from the Midianites.
6:13	t48x			0	What did Gideon think Yahweh had done to the people of Israel?	Gideon thought Yahweh had forsaken them and had allowed the people of Midian to rule over them.
6:15	adcn			0	Why did Gideon think he could not deliver Israel?	Gideon thought he could not deliver Israel because his family was the weakest in Manasseh and he was the youngest in his family.
6:18	sqsu			0	Why did Yahweh wait for Gideon?	Yahweh waited for Gideon to bring him an offering.
6:20	mlzy			0	Where did the angel of God tell Gideon to put the meat and unleavened bread?	The angel of God told Gideon to put the meat and unleavened bread on a rock.
6:21	iw2c			0	What happened when the angel of Yahweh stretched out the end of the staff in his hand?	When the angel of Yahweh stretched out the end of the staff in his hand, touching the meat and the unleavened bread, a fire went up out of the rock and consumed the meat and the unleavened bread.
6:23	il3q			0	Why was Gideon afraid when he understood that he had seen the angel of Yahweh?	Gideon was afraid when he understood that he had seen the angel of Yahweh because he thought he would die.
6:26	vxqp			0	What did Yahweh tell Gideon to build on the top of the stronghold?	Yahweh told him to build an altar to Yahweh on the top of the stronghold.
6:27	jrsd			0	Why did Gideon do what Yahweh told him to do at night?	Gideon did what Yahweh told him to do at night because he was too afraid of his father’s household and the men of the city to do it during the day.
6:30	g7hp			0	Why did the men of the town want to put Gideon to death?	The men wanted to put Gideon to death because he tore down the altar of Baal and because he cut down the Asherah beside it.
6:32	rnvb			0	Why was Gideon given the name, “Jerubbaal”?	Gideon was given the name “Jerubbaal” because it meant “Let Baal defend himself” and they said that Baal should be the one to punish him, since it was his altar Gideon had torn down.
6:37	udzq			0	What did Gideon do to find out if Yahweh intended to use him to save Israel?	Gideon put a woolen fleece on the threshing floor. He said that if there was dew only on the fleece, and if it was dry on all the ground, then he would know that Yahweh would use him to save Israel.
6:38	dyim			0	When Gideon squeezed the fleece and wrung out the dew, how much water was there?	When Gideon squeezed the fleece and wrung out the dew, there was enough water to fill a bowl.
6:39	a050			0	What was Gideon’s second test for God?	Gideon’s second test was for God to make the fleece dry, and let there be dew on all the ground around it.
7:2	ct4p			0	Why did Yahweh have the fearful soldiers return?	Yahweh had the fearful soldiers return so that Israel could not boast against Yahweh saying that their own power had saved them.
7:4	dpco			0	Why did Yahweh tell Gideon to take the soldiers down to the water?	Yahweh said that there were still too many soldiers and this would be the way that he would tell Gideon which ones would go with him.
7:5	gyx4			0	How did Yahweh tell Gideon to separate the soldiers?	Yahweh told Gideon to set apart everyone who lapped up the water as a dog laps from those who knelt down to drink.
7:8	lnrt			0	How many soldiers did Gideon keep?	Gideon kept 300 soldiers and sent the rest home.
7:11	eb8h			0	If Gideon was afraid, what would strengthen Gideon’s courage?	If Gideon was afraid, he was told to go down to the camp and listen to what they were saying, and his courage would be strengthened to attack the camp.
7:14	d9e5			0	When one man was telling a dream to his companion, who did the companion say the dream was about?	When one man was telling a dream to his companion, the companion said the dream was about Gideon. God had given him victory over Midian and all their army.
7:16	eyhg			0	What did Gideon give his 300 soldiers?	Gideon gave them all ram’s horns and empty jars, with a torch inside each jar.
7:19	bdr8			0	When did Gideon’s men blow the trumpets and break the jars that were in their hands?	Just as the Midianites were changing the guard, Gideon’s men blew on the ram’s horns and broke the jars that were in their hands.
7:22	stzi			0	When the soldiers blew the three hundred shofars, what did Yahweh do?	When they blew the three hundred shofars, Yahweh set every Midianite man’s sword against his comrades and against all their own army.
7:24	aysh			0	How far did the men of Ephraim take control of the waters?	The men of Ephraim put guards at the shallow river crossings as far as Beth Barah and the Jordan River.
8:1	dkaw			0	Why did the men of Ephraim argue with Gideon?	The men of Ephraim argued with Gideon because he had not called them to help him when he went to fight against Midian.
8:5	rnv1			0	For what did Gideon ask the men of Succoth?	Gideon asked the men of Succoth for loaves of bread for his soldiers.
8:8	wdqt			0	Why did Gideon tell the men of Penuel that he would pull down the tower?	Gideon told the men of Penuel that he would pull down the tower because they would not give his army bread, just as the men of Succoth had refused.
8:11	r1gd			0	Why did Gideon defeat the enemy army past Nobah and Jogbehah?	Gideon defeated the enemy army because they were feeling safe and not expecting an attack.
8:15	o44z			0	Whom did Gideon show to the men of Succoth before he punished them?	Gideon showed Zebah and Zalmunna to the men of Succoth before he punished them.
8:19	etwk			0	What men did Zebah and Zalmunna kill at Tabor?	Zebah and Zalmunna killed Gideon’s brothers.
8:20	ldh8			0	Why did Jether not draw his sword?	Jether did not draw his sword for he was afraid; he was still a young boy.
8:23	hucn			0	Who did Gideon say would rule over the men of Israel?	Gideon said Yahweh would rule over the men of Israel.
8:24	oazw			0	For what did Gideon ask the men of Israel?	Gideon asked them for the earrings from their spoil.
8:27	zs4u			0	What did Gideon make out of the earrings?	Gideon made an sacred garment out of the earrings.
8:27	vyu8			0	What did Israel do to the golden ephod?	Israel worshiped the ephod.
8:33	y9my			0	What happened as soon as Gideon was dead?	As soon as Gideon was dead, the people of Israel turned again and worshiped the Baals.
9:1	w5fv			0	Who was Abimelech’s father?	Abimelech’s father was Gideon who was also called Jerubbaal.
9:3	s8bw			0	Why did the leaders of Shechem agree to follow Abimelech?	They agreed to follow Abimelech because he was their relative.
9:4	qsc4			0	For what did Abimelech use the 70 pieces of silver?	Abimelech used the 70 pieces of silver to hire wicked and violent men.
9:5	of4p			0	Why was Jotham not murdered?	Jotham was not murdered because he hid himself.
9:18	m3kf			0	On what day did Jotham address the leaders of Shechem?	Jotham addressed them on the same day that they had risen up against his father’s house and killed 70 of his sons.
9:20	iw06			0	What was the curse of Jotham?	The curse of Jotham was for fire to come out from Abimelech to burn up the men of Shechem and Beth Millo, and for fire to come out from the men of Shechem and Beth Millo to burn up Abimelech.
9:24	j38o			0	Why did God allow the leaders of Shechem to deal treacherously with Abimelech?	God allowed the leaders of Shechem to deal treacherously with Abimelech so that the violence done to the 70 sons of Jerubbaal might be avenged.
9:25	lt0r			0	Who did the leaders of Shechem hope to ambush?	The leaders of Shechem hoped to ambush Abimelech.
9:28	jl9y			0	Who wished the people would serve him instead of Abimelech?	Gaal wished the people would serve him.
9:30	eo5e			0	When was Zebul’s anger kindled?	When Zebul heard what Gaal was saying about removing Abimelech, he became angry.
9:31	g2ya			0	Why did Zebul send messengers to Abimelech?	He sent messengers to Abimelech in order to warn him that Gaal, the son of Ebed, was inciting the city against him.
9:36	qn8s			0	How did Zebul describe the men Gaal saw coming down the hills?	Zebul said they were shadows of the hills.
9:38	ax04			0	What did Zebul tell Gaal to do?	Zebul told Gaal to go out and fight against Abimelech.
9:40	z7va			0	What happened when Gaal fought Abimelech?	Abimelech pursued Gaal, and Gaal fled before Abimelech, and many fell with deadly wounds before the entrance to the city gate.
9:45	u7l2			0	What did Abimelech do after he captured the city?	Abimelech killed the people, tore down the city, and spread salt over it.
9:46	u0vj			0	Where did the leaders of the tower of Shechem enter?	The leaders of the tower of Shechem entered the citadel of the house of El-Berith.
9:49	mu3p			0	How did Abimelech kill all the leaders and people in the tower of Shechem?	Abimelech went up to Mount Zalmon, piled branches around the fortress and set it on fire, killing all the people in it.
9:53	jv8o			0	When Abimelech came near the entrance of the tower of Thebez, what happened to him?	When Abimelech came near the entrance of the tower of Thebez, a woman on the roof dropped a millstone on his head and it crushed his skull.
9:54	o93q			0	Why did Abimelech tell his armor-bearer to draw his sword and kill him?	Abimelech told his armor-bearer to draw his sword and kill him so no one would say a women killed Abimelech.
10:1	tq8b			0	Where was Shamir?	Shamir was in the hill country of Ephraim.
10:6	q67b			0	Why did Yahweh burn with anger toward the people of Israel?	The people of Israel forsook Yahweh and no longer served him, so he became angry with Israel.
10:9	hsb1			0	Why was Israel greatly distressed?	The Ammonites crossed over the Jordan to fight against the people of Judah, Benjamin, and Ephraim, so that Israel was greatly distressed.
10:14	wx9g			0	To whom did Yahweh tell the people of Israel to call out for help?	Yahweh told the people to call out to the gods that they had worshiped to show them that those gods could not save them.
10:16	va6g			0	Why could Yahweh no longer bear the misery of Israel?	Israel removed the foreign gods from their midst and they worshiped Yahweh, so he had compassion on them.
11:1	vpt6			0	Who were Jephthah’s parents?	Jephthah was the son of a prostitute and Gilead.
11:6	ztd7			0	Why did the elders of Gilead go to bring Jephthah back from the land of Tob?	The elders of Gilead went to bring Jephthah back from the land of Tob so he would be their commander in their fight against the Ammonites.
11:8	xvxj			0	Why did the elders of Gilead come to Jephthah?	The elders of Gilead came to Jephthah because they wanted him to come with them to fight the Ammonites and be their leader.
11:9	ksgz			0	If the elders of Gideon brought Jephthah home again to fight against the soldiers of Ammon, and if Yahweh gave them victory over them, what would happen to Jephthah?	If the elders of Gideon brought Jephthah home again to fight against the soldiers of Ammon, and if Yahweh gave them victory over them, Jephthah would be their leader.
11:13	tsff			0	Why did the people of Ammon come to fight to take the land of Israel?	The people of Ammon came to take the land of Israel because they claimed that when Israel came up out of Egypt, Israel seized the land of Ammon.
11:17	c205			0	Who was not willing to let Israel pass?	The king of Edom and the king of Moab were not willing to let Israel pass.
11:21	ha07			0	Who gave Israel victory over Sihon?	Yahweh, the God of Israel, gave Israel victory over Sihon.
11:26	kqeg			0	For how long did Israel live in Heshbon and its villages and in Aroer and its villages and in all the cities that are along the banks of the Arnon?	Israel lived for 300 years in Heshbon and Aroer and their villages as well as in all the cities that are along the banks of the Arnon.
11:31	a8zn			0	If Yahweh gave Jephthah victory over the people of Ammon, what did Jephthah vow to do?	If Yahweh gave Jephthah victory over the people of Ammon, Jephthah would offer up as a burnt offering whoever came out of the doors of his house to greet him.
11:32	clg2			0	When Jephthah passed through to the people of Ammon to fight against them, who gave him the victory?	When Jephthah passed through to the people of Ammon to fight against them, Yahweh gave him victory.
11:34	ytol			0	How many children did Jephthah have?	Jephthah had only one child, this daughter.
11:37	jnc6			0	What did Jephthah’s daughter want to do before he did everything he had promised?	She wanted him to leave her alone for two months, that she could go down to the hills and grieve over her virginity.
11:39	ge7m			0	What did Jephthah do with his daughter?	He did what he had promised in the vow he had made.
12:1	scmk			0	What did the men of Ephraim want to do to Jephthah’s house because he did not call them to go with him?	The men of Ephraim wanted to burn Jephthah’s house down because he did not call them to go with him to fight against the people of Ammon.
12:4	fnbv			0	Why did the men of Gilead attack the men of Ephraim?	The men of Gilead attacked the men of Ephraim because Ephraimites said the Gileadites were fugitives from Ephraim.
12:6	xeom			0	How did the men of Gilead test if a man was from Ephraim?	They would tell him to say “Shibboleth.” And if he said, “Sibboleth,” (for the Ephraimites could not pronounce the word correctly), the Gileadites would seize him and kill him at the fords of the Jordan.
13:2	cagx			0	What clan was Manoah from?	Manoah was from the clan of Dan.
13:5	q3og			0	Why was no razor to come onto the child’s head?	No razor was to come onto his head, for the child was to be a Nazirite to God.
13:6	etrv			0	What did the man of God look like?	The man of God looked like an angel of God.
13:9	iwhe			0	When the angel of God came a second time, who was there?	When the angel of God came a second time, only Manoah’s wife was there.
13:12	q7wn			0	What did Manoah ask the angel about?	Manoah asked the angel about the rules for the boy and what his work would be.
13:16	nhhj			0	If Manoah prepared a burnt offering, to whom was he to offer it?	If Manoah prepared a burnt offering, he was to offer it to Yahweh.
13:20	jp46			0	What wonderful thing did Yahweh do while Manoah and his wife were watching?	While Manoah and his wife were watching, the angel of Yahweh went up in the flame of the altar.
13:25	o6py			0	Where did Yahweh’s Spirit begin to stir Samson?	Yahweh’s Spirit began to stir Samson in Mahaneh Dan.
14:2	hal5			0	Who did Samson want his parents to get for him to be his wife?	Samson wanted his parents to get for him a woman in Timnah, one of the daughters of the Philistines, to be his wife.
14:3	cp14			0	Why did Samson want his parents to get him the woman in Timnah as his wife?	He wanted his parents to get him the woman in Timnah as his wife, for when he looked at her, she pleased him.
14:6	x5ly			0	How was Samson able to tear the lion apart?	Yahweh’s Spirit suddenly came on him, and he tore the lion apart.
14:8	zpwg			0	What was in the carcass of the lion?	There was a swarm of bees and honey in the carcass of the lion.
14:13	x9mb			0	What would Samson get if the 30 companions could not answer his riddle?	Samson would get 30 linen robes and 30 changes of clothes if the 30 companions could not answer his riddle.
14:15	st3b			0	What would happen to Samson’s wife if she did not entice her husband to get the answer to the riddle?	If Samson’s wife did not entice her husband to get the answer to the riddle, the 30 companions would burn up her and her father’s house.
14:17	mr3d			0	For how long did Samson’s wife cry in order to get the answer to the riddle?	She cried for the seven days that the feast lasted.
14:19	g561			0	How did Samson get 30 changes of clothing?	Samson went down to Ashkelon and killed 30 men among those people and took their changes of clothing.
15:2	xf27			0	When Samson went to visit his wife, why did her father not allow him to go in?	The father thought Samson hated his wife, so had already given her to one of Samson’s companions.
15:5	q2gs			0	How did Samson retaliate after finding out his wife had been given to another?	Samson retaliated by catching 300 foxes, tying torches to them, and letting them go in the Philistines’ grain.
15:6	hcqx			0	When the Philistines were told that Samson burned their fields, what did they do?	When the Philistines were told that Samson burned their fields, they burned his wife and her father.
15:8	rss9			0	Why did Samson kill a great number of Philistines?	Samson killed a great number of Philistines to avenge the killing of his wife and her father.
15:10	w9gu			0	Why did the Philistines come up to attack Judah?	The Philistines came up to attack Judah so they could capture Samson in order to kill him as he had killed so many of them.
15:12	so92			0	When the men of Judah came to tie up Samson, what did he make them swear?	When the men of Judah came to tie up Samson, he made them swear that they would not kill him themselves.
15:15	nqvj			0	With what did Samson kill 1,000 men?	Samson killed 1,000 men with a fresh jawbone of a donkey.
15:18	pzyn			0	After Samson killed 1,000 men with a fresh jawbone of a donkey, how did he think he would die?	After Samson killed 1,000 men with a fresh jawbone of a donkey, he thought he would die of thirst.
