Reference	ID	Tags	Quote	Occurrence	Question	Response
15:19	shoz			0	How did Samson get water?	God split open the hollow place at Lehi, and water came out.
16:2	ewwz			0	When did the Gazites plan to kill Samson?	The Gazites planned to kill Samson at daylight.
16:3	mzwv			0	How did Samson escape Gaza?	Samson took hold of the city gate and its two posts, and he pulled them up out of the ground, bar and all.
16:5	dhbt			0	If Delilah enticed Samson to tell her the secret of his strength, what would the leaders of the Philistines give her?	If Delilah enticed Samson to tell her the secret of his strength, each of the Philistine leaders would give her 1,100 pieces of silver.
16:9	fe7p			0	When Delilah told Samson the Philistines were upon him, what did he do?	When Delilah told Samson the Philistines were upon him, he broke the cords with which he was tied.
16:12	ie6p			0	When Samson tore off the new ropes from his arms, where were the men lying in wait?	When Samson tore off the new ropes from his arms, the men were waiting in one of the rooms of the house.
16:16	ycpb			0	How much did Delilah beg Samson to tell her his secret?	She begged him so much that he wished he would die.
16:17	eyp0			0	Why had Samson never cut the hair on his head?	Samson had never cut the hair on his head, for he had been a Nazirite of God from his mother’s womb.
16:19	sm10			0	How was Delilah able to subdue Samson?	Delilah was able to subdue him when the locks of his head were shaven off, for his strength left him.
16:21	b13h			0	What work did the Philistines make Samson do?	The Philistines made Samson turn the millstone to grind grain in the prison.
16:23	w3ie			0	Why did the leaders of the Philistines gather together to offer a great sacrifice to Dagon their god?	The leaders of the Philistines had a celebration to offer sacrifices to Dagon their god because they said he had conquered Samson.
16:26	fdqe			0	Who helped Samson touch the columns on which the building rested?	The young man leading Samson by the hand led him so he could touch the columns which supported the building.
16:28	mh4s			0	Why did Samson want God to strengthen him?	Samson wanted God to strengthen him so that he could have revenge in one blow on the Philistines for taking his two eyes.
16:30	e3yf			0	How many people did Samson kill when the building fell?	Samson killed more at his death than those he had killed during his life.
17:2	qysg			0	What did Micah steal?	Micah stole 1,100 pieces of silver from his mother.
17:3	il0o			0	For what did Micah’s mother set apart the silver?	Micah’s mother said she had dedicated the silver to Yahweh, for her son to make an idol.
17:5	webl			0	To what did Micah appoint one of his sons?	He appointed one of his sons to become his priest.
17:8	xy2r			0	Why did the Levite leave Bethlehem?	The Levite left Bethlehem to go and find a place to live.
17:10	r6uk			0	What did Micah ask the Levite to be to him?	Micah asked the Levite to live with him and be an adviser and a priest to him.
17:13	tyai			0	Why did Micah think Yahweh would be good to him?	Micah thought Yahweh would be good to him because he had a Levite as his priest.
18:1	e4u2			0	Why were the descendants of Dan looking for a territory in which to live?	The descendants of Dan were looking for a territory in which to live because they had not been able to occupy all of the territory that had been assigned to them.
18:5	rhwo			0	What did the people of Dan want the Levite to ask God?	The people of Dan wanted the Levite to ask God if they would succeed in what they were trying to do.
18:9	zd8a			0	What did the five men from Dan want to do with the land of Laish?	The five men from Dan wanted to take possession of the land so their people could live there.
18:14	shz9			0	What did the five men say was in the houses of Laish?	The five men said that in the houses of Laish there were a sacred vest, household idols, and a silver molded figure.
18:24	tlmz			0	Why was Micah angry?	Micah was angry because the Danites stole the idols he had made and his priest and they were leaving.
18:26	hpy3			0	Why did Micah turn and go back to his house?	When Micah saw that they were too strong for him, he turned and went back to his house.
18:28	ramy			0	Why was there no one to rescue the people of Laish?	There was no one to rescue the people of Laish because it was a long way from Sidon and they had no other allies.
18:30	h3z1			0	Who were the priests for the tribe of the Danites?	Jonathan, the son of Gershom, (the grandson of Moses) and his sons were priests for the tribe of Dan.
19:1	zzfz			0	Where was the Levite living?	The Levite was living in a remote area of the hill country of Ephraim.
19:3	fcw2			0	Where did the Levite’s concubine bring him?	The concubine brought the Levite into the house of her father.
19:6	h1pf			0	Although the Levite intended to go home, what did his father-in-law want him to do?	His father-in-law wanted him to stay and spend the night.
19:9	ppa6			0	What did the Levite’s father-in-law ask him to do again on the fifth day?	His father-in-law asked him to stay another night and have a good time.
19:12	tktu			0	Why did the Levite not want to spend the night in Jebus?	The Levite did not want to stay in a city where there were no other Israelites.
19:15	vr21			0	Why did the Levite and his servant sit down in the city square?	They sat down in the city square, for no one had offered them a place to stay for the night.
19:16	l2gf			0	From what tribe were the men living in Gibeah?	The men living in Gibeah were from the tribe of Benjamin.
19:20	ckdg			0	What did the old man warn the Levite not to do?	The old man warned the Levite not to spend the night in the open square.
19:22	otbh			0	Why did the wicked men of the city want the old man to bring out the man who was staying in his house?	The wicked men of the city wanted the old man to bring out the man who came was staying in his house so they could have sex with him.
19:24	w483			0	Who did the old man offer to the wicked men in place of the Levite?	The old man offered them his virgin daughter and the Levite’s concubine.
19:26	htpo			0	What happened at dawn?	At dawn the wicked men let the concubine go. She came and she fell down at the door of the man’s house where her master was, and she lay there until it was light.
19:28	uspj			0	What did the Levite do when his concubine did not answer him?	When the Levite’s concubine did not answer him, he put her body on the donkey and set out for home.
19:29	v4gq			0	What did the Levite do to his concubine’s body?	The Levite cut her up into twelve pieces and sent the pieces to each of the tribes throughout Israel.
20:1	dkqg			0	Who gathered together before Yahweh at Mizpah?	All the people from Dan to Beersheba, including the land of Gilead, gathered together before Yahweh at Mizpah.
20:5	vt7k			0	What did the Levite say the men of Gibeah did to him?	The Levite said the men of Gibeah surrounded the house in order to abuse and kill him.
20:13	rhry			0	Why did the tribes of Israel tell Benjamin to give them those wicked men of Gibeah?	The tribes of Israel told Benjamin to give them those wicked men of Gibeah, so they might put them to death in order to completely remove this evil from Israel.
20:14	j3kn			0	Why did the people of Benjamin come together at Gibeah?	The people of Benjamin came together at Gibeah to defend it against the people of Israel.
20:16	t09j			0	What was special about the 700 chosen men?	The 700 chosen men were left-handed; each of them could sling a stone with great accuracy.
20:18	w349			0	Why did Judah attack Benjamin?	The people asked God and he told them that Judah should attack first.
20:26	n5da			0	After Benjamin killed many soldiers of Israel, what did the soldiers of Israel do?	After Benjamin killed many soldiers of Israel, the soldiers of Israel wept and fasted before Yahweh until evening. They also offered burnt offerings and peace offerings to Yahweh.
20:27	nhb7			0	Where was the Box of the Covenant of God in those days?	The Box of the Covenant of God was in Bethel at that time.
20:32	mnad			0	When the soldiers of Israel drew away from the city, what did the people of Benjamin think?	When the soldiers of Israel drew away from the city, the people of Benjamin thought they had defeated them and they were running away.
20:36	t142			0	Why had the men of Israel retreated?	The men of Israel had retreated because they wanted the Benjaminites to be drawn out of the city where they had men hidden outside Gibeah waiting to attack them.
20:38	vrf5			0	What was the signal between the soldiers of Israel and the men hiding in secret?	The arranged signal between the soldiers of Israel and the men hiding in secret was that a great cloud of smoke would rise up out of the city.
20:42	wbt1			0	Why could the men of Benjamin not escape?	The men of Benjamin ran away from the soldiers of Israel, trying to escape into the wilderness, but they were caught between the two groups of Israelites.
20:47	wf01			0	How many soldiers of Benjamin turned and fled to the wilderness?	Six hundred men were able to escape to the wilderness.
21:3	sb0j			0	Why did the men of Israel say that one of their tribes might not exist anymore?	The men of Israel worried that the Benjaminite tribe would no longer exist since they had promised to not allow their daughters to marry a Benjaminite so the remaining men would not have women to marry.
21:5	syy4			0	Who would certainly be put to death?	Anyone who did not come when they met with Yahweh at Mizpah would certainly be put to death.
21:8	x72t			0	Which of the cities did not come to meet with Yahweh at Mizpah?	No one from the city of Jabesh Gilead had come to meet with Yahweh at Mizpah.
21:12	sv35			0	Who did the men take from those living in Jabesh Gilead?	The men took 400 young women who had never slept with a man from those living in Jabesh Gilead.
21:14	vmkm			0	What was the problem when the Benjaminites were given the women of Jabesh Gilead?	When the Benjaminites were given the women of Jabesh Gilead, there were not enough women for all of them to marry.
21:19	skm0			0	Where was Shiloh?	Shiloh was north of Bethel, east of the road that went up from Bethel to Shechem, and south of Lebonah.
21:21	w5c5			0	When were the Benjaminites to each rush out of the vineyards and grab a wife from the young women of Shiloh?	When the young women from Shiloh came out to dance, each Benjaminite was to rush out of the vineyards and grab a young woman as his wife.
21:22	qcqn			0	Why would the men of Shiloh not be guilty of breaking their oath?	The men of Shiloh were told that they had not broken their oath since they had not given their daughters to the Benjaminites as wives but instead, the young women had been stolen.
21:25	r802			0	How did everyone live in those days when Israel had no king?	Everyone did what he thought was right in his own eyes.
