Reference	ID	Tags	Quote	Occurrence	Question	Response
30:30	ds4q			0	What does not turn away from anything?	The lion does not turn away from anything.
30:32	uv0v			0	What should a person do who has been plotting evil?	A person who has been devising evil should stop doing so immediately.
30:33	bmvf			0	What does anger produce?	Anger causes people to fight.
31:1	fel2			0	Who wrote this proverb?	King Lemuel wrote this proverb.
31:3	vk4d			0	To whom should a man not give his strength?	He should not give his strength to women and exhaust himself by having sex with them.
31:5	i3ke			0	What do rulers forget when they have strong drink?	Rulers forget what has been decreed when they have strong drink.
31:7	ic42			0	What do those in bitter distress forget when they have strong drink?	Those in bitter distress forget what troubles them when they have strong drink.
31:9	mk46			0	Whose cause should the king plead?	The king should plead for suffering and poor people to get what they legally deserve.
31:10	n5qf			0	What is more valuable than jewels?	A virtuous and capable wife is more valuable than precious jewels.
31:12	iuuu			0	What does the capable wife do all the days of her life?	She does good for her husband and not evil all the days of her life.
31:15	qs3h			0	When does the capable wife arise?	She arises while it is still night.
31:17	rppp			0	How does the capable wife care for her body?	She keeps her body strong and she makes her arms strong by working hard.
31:20	i290			0	Whom does the capable wife generously help?	She generously helps people who are poor and suffering.
31:23	j4xg			0	Where does the capable wife’s husband sit?	Her husband sits with the elders at the gates.
31:26	u9ix			0	How does the capable wife speak?	She speaks wisely, and when she speaks, she teaches others to be faithful and kind.
31:28	zydh			0	What do the children of the capable wife call her?	Her children call her blessed.
31:30	qdjg			0	What kind of woman will be praised?	People will praise a woman who fears Yahweh.
